URL,Content
https://www.cisa.gov/news-events/cybersecurity-advisories/aa23-353a,"MITIGATIONS These mitigations apply to all critical infrastructure organizations and network defenders. FBI, CISA, and HHS recommend that software manufactures incorporate secure by design principles and tactics into their software development practices limiting the impact of ransomware techniques, thus, strengthening the security posture for their customers. For more information on secure by design, see CISA’sSecure by Designwebpage andjoint guide. FBI, CISA, and HHS recommend organizations implement the mitigations below to improve your organization’s cybersecurity posture based on threat actor activity and to reduce the risk of compromise by ALPHV Blackcat threat actors. These mitigations align with the Cross-Sector Cybersecurity Performance Goals (CPGs) developed by CISA and the National Institute of Standards and Technology (NIST). The CPGs provide a minimum set of practices and protections that CISA and NIST recommend all organizations implement. CISA and NIST based the CPGs on existing cybersecurity frameworks and guidance to protect against the most common and impactful threats, tactics, techniques, and procedures. Visit CISA’sCross-Sector Cybersecurity Performance Goalsfor more information on the CPGs, including additional recommended baseline protections. Due to the threat ALPHV Blackcat’s poses in the healthcare sector, healthcare organizations can look to theHealthcare and Public Health (HPH) Sector Cybersecurity Performance Goalsto implement cybersecurity protections against the most common threats. tactics, techniques, and procedures used against this sector. Secure remote access tools by:Implementing application controlsto manage and control execution of software, including allowlisting remote access programs. Application controls should prevent installation and execution of portable versions of unauthorized remote access and other software. A properly configured application allowlisting solution will block any unlisted application execution. Allowlisting is important because antivirus solutions may fail to detect the execution of malicious portable executables when the files use any combination of compression, encryption, or obfuscation.Applying recommendations in CISA's jointGuide to Securing Remote Access Software.Implementing FIDO/WebAuthn authentication or Public key Infrastructure (PKI)-based MFA[CPG 2.H][HPH CPG – Multifactor Authentication]. These MFA implementations are resistant to phishing and not susceptible to push bombing or SIM swap attacks, which are techniques known be used by ALPHV Blackcat affiliates. See CISA’s Fact SheetImplementing Phishing-Resistant MFAfor more information.Identify, detect, and investigate abnormal activity and potential traversal of the indicated ransomware with a networking monitoring tool.To aid in detecting ransomware, implement a tool that logs and reports all network traffic [CPG 5.1][HPH CPG – Detect and Respond to Relevant Threats and Tactics, Techniques and Procedures], including lateral movement activity on a network. Endpoint detection and response (EDR) tools are useful for detecting lateral connections as they have insight into common and uncommon network connections for each host.Implement user training on social engineering and phishing attacks[CPG 2.I][HPH CPG – Basic Cybersecurity Training]. Regularly educate users on identifying suspicious emails and links, not interacting with those suspicious items, and the importance of reporting instances of opening suspicious emails, links, attachments, or other potential lures.Implement internal mail and messaging monitoring. Monitoring internal mail and messaging traffic to identify suspicious activity is essential as users may be phished from outside the targeted network or without the knowledge of the organizational security team. Establish a baseline of normal network traffic and scrutinize any deviations.Implement free security toolsto prevent cyber threat actors from redirecting users to malicious websites to steal their credentials. For more information see, CISA’sFree Cybersecurity Services and Toolswebpage.Install and maintain antivirus software.Antivirus software recognizes malware and protects your computer against it. Installing antivirus software from a reputable vendor is an important step in preventing and detecting infections. Always visit vendor sites directly rather than clicking on advertisements or email links. Because attackers are continually creating new viruses and other forms of malicious code, it is important to keep your antivirus software up to date."
https://www.cisa.gov/news-events/cybersecurity-advisories/aa23-349a,"MITIGATIONS NETWORK DEFENDERS CISA recommends HPH Sector and other critical infrastructure organizations implement the mitigations in Table 6 to mitigate the issues listed in the Findings section of this advisory. These mitigations align with the Cross-Sector Cybersecurity Performance Goals (CPGs) developed by CISA and the National Institute of Standards and Technology (NIST). The CPGs provide a minimum set of practices and protections that CISA and NIST recommend all organizations implement. CISA and NIST based the CPGs on existing cybersecurity frameworks and guidance to protect against the most common and impactful threats, tactics, techniques, and procedures. Visit CISA’sCross-Sector Cybersecurity Performance Goalsfor more information on the CPGs, including additional recommended baseline protections. Additionally, CISA recommends that HPH sector organizations implement the following strategies to mitigate cyber threats: Mitigation Strategy #1 Asset Management and Security:CISA recommends that HPH sector organizations implement and maintain an asset management policy to reduce the risk of exposing vulnerabilities, devices, or services that could be exploited by threat actors to gain unauthorized access, steal sensitive data, or disrupt critical services. The focus areas for this mitigation strategy include asset management and asset security, addressing asset inventory, procurement, decommissioning, and network segmentation as they relate to hardware, software, and data assets.Mitigation Strategy #2 Identity Management and Device Security:CISA recommends entities secure their devices and digital accounts and manage their online access to protect sensitive data and PII/PHI from compromise. The focus areas for this mitigation strategy include email security, phising prevention, access management, password policies, data protection and loss prevention, and device logs and monitoring solutions.Mitigation Strategy #3 Vulnerability, Patch, and Configuration Management:CISA recommends entities mitigate known vulnerabilities and establish secure configuration baselines to reduce the likelihood of threat actors exploiting known vulnerabilities to breach organizational networks. The focus areas for this mitigation strategy include vulnerability and patch Management, and configuration and change management. For more information on these mitigations strategies, see CISA’sHealthcare and Public Health Sectorwebpage. SOFTWARE MANUFACTURERS The above mitigations apply to HPH sector and other critical infrastructure organizations with on-premises or hybrid environments. Recognizing that insecure software is the root cause of the majority of these flaws, and that the responsibility should not be on the end user, CISA urges software manufacturers to implement the following to reduce the prevalence of misconfigurations, weak passwords, and other weaknesses identified and exploited through the assessment team: Embed security into product architecture throughout theentiresoftware development lifecycle (SDLC).Eliminate default passwords. Do not provide software with default passwords. To eliminate default passwords, require administrators set a “strong” password [CPG 2.B] during installation and configuration.Create secure configuration templates. Provide configuration templates with certain safe settings based on an organization’s risk appetite (e.g., low, medium, and high security templates). Support these templates with hardening guides based on the risks the manufacturer has identified. The default configuration should be a secure one, and organizations should need to opt in if they desire a less secure configuration.Design products so that the compromise of a single security control does not result in compromise of the entire system. For example, narrowly provision user privileges by default and employ ACLs to reduce the impact of a compromised account. This will make it more difficult for a malicious cyber actor to escalate privileges and move laterally.Mandate MFA,ideally phishing-resistant MFA, for privileged usersand make MFA a default, rather than opt-in, feature. These mitigations align with tactics provided in the joint guideShifting the Balance of Cybersecurity Risk: Principles and Approaches for Secure by Design Software. CISA urges software manufacturers to take ownership of improving the security outcomes of their customers by applying these and other secure by design tactics. By using secure by design tactics, software manufacturers can make their product lines secure “out of the box” without requiring customers to spend additional resources making configuration changes, purchasing security software and logs, monitoring, and making routine updates. For more information on secure by design, see CISA’sSecure by Designwebpage. For more information on common misconfigurations and guidance on reducing their prevalence, see the joint advisoryNSA and CISA Red and Blue Teams Share Top Ten Cybersecurity Misconfigurations."
https://www.cisa.gov/news-events/cybersecurity-advisories/aa23-347a,"MITIGATIONS The FBI, CISA, NSA, SKW, CERT Polska, and NCSC assess the scope and indiscriminate targeting of this campaign poses a threat to public safety and recommend organizations implement the mitigations below to improve organization’s cybersecurity posture. These mitigations align with the Cross-Sector Cybersecurity Performance Goals (CPGs) developed by CISA and the National Institute of Standards and Technology (NIST). The CPGs provide a minimum set of practices and protections that CISA and NIST recommend all organizations implement. CISA and NIST based the CPGs on existing cybersecurity frameworks and guidance to protect against the most common and impactful threats, tactics, techniques, and procedures. Visit CISA’sCross-Sector Cybersecurity Performance Goalsfor more information on the CPGs, including additional recommended baseline protections. Apply available patchesfor CVE-2023-42793 issued by JetBrains TeamCity in mid-September 2023, if not already completed.Monitor the networkfor evidence of encoded commands and execution of network scanning tools.Ensure host-based anti-virus/endpoint monitoring solutions are enabledand set to alert if monitoring or reporting is disabled, or if communication is lost with a host agent for more than a reasonable amount of time.Require use of multi-factor authentication[CPG 1.3] for all services to the extent possible, particularly for email, virtual private networks, and accounts that access critical systems.Organizations should adopt multi-factor authentication (MFA) as an additional layer of security for all users with access to sensitive data. Enabling MFA significantly reduces the risk of unauthorized access, even if passwords are compromised.Keep all operating systems, software, and firmware up to date.Immediately configure newly-added systems to the network, including those used for testing or development work, to follow the organization’s security baseline and incorporate into enterprise monitoring tools.Audit log filesto identify attempts to access privileged certificates and creation of fake identity providers.Deploy software to identify suspicious behavior on systems.Deploy endpoint protection systemswith the ability to monitor for behavioral indicators of compromise.Use available public resources to identify credential abuse with cloud environments.Configure authentication mechanismsto confirm certain user activities on systems, including registering new devices."
https://www.cisa.gov/news-events/cybersecurity-advisories/aa23-341a,"MITIGATIONS A number of mitigations will be useful in defending against the activity described in this advisory. Use strong passwords. Use a separate password for email accounts and avoid password re-use across multiple services.See NCSC guidance:Top Tips for Staying Secure Online.Use multi-factor authentication(2-factor authentication/two-step authentication) to reduce the impact of password compromises. See NCSC guidance:Multi-factor Authentication for Online ServicesandSetting Up 2-Step Verification (2SV).Protect your devices and networks by keeping them up to date:Use the latest supported versions, apply security updates promptly, use anti-virus and scan regularly to guard against known malware threats. See NCSC guidance:Device Security Guidance.Exercise vigilance.Spearphishing emails are tailored to avoid suspicion. You may recognize the sender’s name, but has the email come from an address that you recognize? Would you expect contact from this person’s webmail address rather than their corporate email address? Has the suspicious email come to your personal/webmail address rather than your corporate one? Can you verify that the email is legitimate via another means? See NCSC guidance:Phishing attacks: Defending Your OrganizationandInternet Crime Complaint Center(IC3) | Industry Alerts.Enable your email providers’ automated email scanning features.These are turned on by default for consumer mail providers. See NCSC guidance:Telling Users to ""Avoid Clicking Bad Links"" Still Isn’t Working.Disable mail-forwarding.Attackers have been observed to set up mail-forwarding rules to maintain visibility of target emails. If you cannot disable mail-forwarding, then monitor settings regularly to ensure that a forwarding rule has not been set up by an external malicious actor."
https://www.cisa.gov/news-events/cybersecurity-advisories/aa23-339a,"MITIGATIONS CISA recommends organizations implement the mitigations below to improve your organization’s cybersecurity posture based on threat actor activity. These mitigations align with the Cross-Sector Cybersecurity Performance Goals (CPGs) developed by CISA and the National Institute of Standards and Technology (NIST). The CPGs provide a minimum set of practices and protections that CISA and NIST recommend all organizations implement. CISA and NIST based the CPGs on existing cybersecurity frameworks and guidance to protect against the most common and impactful threats, tactics, techniques, and procedures. Visit CISA’sCross-Sector Cybersecurity Performance Goalsfor more information on the CPGs, including additional recommended baseline protections. These mitigations apply to all critical infrastructure organizations and network defenders. CISA recommends that software manufacturers incorporate secure-by-design and -default principles and tactics into their software development practices, limiting the impact of threat actor techniques and strengthening the security posture for their customers. For more information on secure by design, see CISA’sSecure by Designwebpage. MANAGE VULNERABILITIES AND CONFIGURATIONS Upgrade all versions affected by this vulnerability.Keep all software up to date and prioritize patching according to CISA’sKnown Exploited Vulnerabilities Catalog[1.E].Prioritize remediation of vulnerabilities on internet-facing systems,for example, by conducting continuous automated and/or routine vulnerability scans.Prioritize secure-by-default configurationssuch as eliminating default passwords, implementing single sign-on (SSO) technology via modern open standards. This also includes disabling default credentials. SEGMENT NETWORKS Employ proper network segmentation, such as a demilitarized zone (DMZ)[2.F]. The end goal of a DMZ network is to allow an organization to access untrusted networks, such as the internet, while ensuring its private network or local area network (LAN) remains secure. Organizations typically store external-facing services and resources—as well as servers used for DNS, file transfer protocol (FTP), mail, proxy, voice over internet protocol (VoIP)—and web servers in the DMZ.Use a firewall or web-application firewall (WAF) and enable logging[2.G, 2.T] to prevent/detect potential exploitation attempts. Review ingress and egress firewall rules and block all unapproved protocols. Limit risky (but approved) protocols through rules.Implement network segmentation to separate network segments based on role and functionality[2.E].Proper network segmentation significantly reduces the ability for threat actor lateral movement by controlling traffic flows between—and access to—various subnetworks. See CISA’sLayering Network Security Through Segmentationinfographic and the National Security Agency’s (NSA’s)Segment Networks and Deploy Application-Aware Defenses.Deploy application-aware network defenses to block improperly formed traffic and restrict content,according to policy and legal authorizations. Traditional intrusion detection systems (IDS) based on known-bad signatures are quickly decreasing in effectiveness due to encryption and obfuscation techniques. Threat actors hide malicious actions and remove data over common protocols, making the need for sophisticated, application-aware defensive mechanisms critical for modern network defenses. APPLICATION CONTROL Enforce signed software execution policies.Use a modern operating system that enforces signed software execution policies for scripts, executables, device drivers, and system firmware. Maintain a list of trusted certificates to prevent and detect the use and injection of illegitimate executables. Execution policies, when used in conjunction with a secure boot capability, can assure system integrity.Application control should be used with signed software execution policies to provide greater control. Allowing unsigned software enables threat actors to gain a foothold and establish persistence through embedded malicious code. See NSA’sEnforce Signed Software Execution Policies. MANAGE ACCOUNTS, PERMISSIONS, AND WORKSTATIONS Requirephishing-resistant multifactor authentication (MFA)[2.H] for all services to the extent possible, particularly for webmail, VPN, and accounts that access critical systems.Implement the principle of least privilegeto decrease threat actors’ abilities to access key network resources.Restrict file and directory permissions. Use file system access controls to protect folders such as C:\Windows\System32.Restrict NTLM authentication policy settings,including incoming NTLM traffic from client computers, other member servers, or a domain controller.[8]"
