URL,Content
https://www.cisa.gov/news-events/cybersecurity-advisories/aa23-284a,"MITIGATIONS These mitigations apply to all critical infrastructure organizations and network defenders. The FBI and CISA recommend that software manufactures incorporate secure-by-design and -default principles and tactics into their software development practices to limit the impact of ransomware techniques (such as threat actors leveraging backdoor vulnerabilities into remote software systems), thus, strengthening the secure posture for their customers. For more information on secure by design, see CISA’sSecure by Design and Defaultwebpage andjoint guide. FBI and CISA recommend organizations implement the mitigations below to improve your cybersecurity posture on the basis of the threat actor activity and to reduce the risk of compromise by AvosLocker ransomware. These mitigations align with the Cross-Sector Cybersecurity Performance Goals (CPGs) developed by CISA and the National Institute of Standards and Technology (NIST). The CPGs provide a minimum set of practices and protections that CISA and NIST recommend all organizations implement. CISA and NIST based the CPGs on existing cybersecurity frameworks and guidance to protect against the most common and impactful threats, tactics, techniques, and procedures. Visit CISA’sCross-Sector Cybersecurity Performance Goalsfor more information on the CPGs, including additional recommended baseline protections. Secure remote access tools by:Implementing application controlsto manage and control execution of software, including allowlisting remote access programs. Application controls should prevent installation and execution of portable versions of unauthorized remote access and other software. A properly configured application allowlisting solution will block any unlisted application execution. Allowlisting is important because antivirus solutions may fail to detect the execution of malicious portable executables when the files use any combination of compression, encryption, or obfuscation.Applying recommendations in CISA's jointGuide to Securing Remote Access Software.Strictly limit the use of RDP and other remote desktop services. If RDP is necessary, rigorously apply best practices, for example [CPG 2.W]:Audit the network for systems using RDP.Close unused RDP ports.Enforce account lockouts after a specified number of attempts.Applyphishing-resistant multifactor authentication (MFA).Log RDP login attempts.Disable command-line and scripting activities and permissions[CPG 2.N].Restrict the use of PowerShell, using Group Policy, and only grant access to specific users on a case-by-case basis. Typically, only those users or administrators who manage the network or Windows operating systems (OSs) should be permitted to use PowerShell [CPG 2.E].Update Windows PowerShell or PowerShell Coreto the latest version and uninstall all earlier PowerShell versions. Logs from Windows PowerShell prior to version 5.0 are either non-existent or do not record enough detail to aid in enterprise monitoring and incident response activities [CPG 1.E, 2.S, 2.T].Enable enhanced PowerShell logging[CPG 2.T, 2.U].PowerShell logs contain valuable data, including historical OS and registry interaction and possible TTPs of a threat actor’s PowerShell use.Ensure PowerShell instances, using the latest version, have module, script block, and transcription logging enabled (enhanced logging).The two logs that record PowerShell activity are the PowerShell Windows Event Log and the PowerShell Operational Log. FBI and CISA recommend turning on these two Windows Event Logs with a retention period of at least 180 days. These logs should be checked on a regular basis to confirm whether the log data has been deleted or logging has been turned off. Set the storage size permitted for both logs to as large as possible. Configure the Windows Registry to require User Account Control (UAC) approval for any PsExec operationsrequiring administrator privileges to reduce the risk of lateral movement by PsExec. In addition, FBI and CISA recommend network defenders apply the following mitigations to limit potential adversarial use of common system and network discovery techniques and to reduce the impact and risk of compromise by ransomware or data extortion actors: Disable File and Printer sharing services.If these services are required, use strong passwords or Active Directory authentication.Implement a recovery planto maintain and retain multiple copies of sensitive or proprietary data and servers in a physically separate, segmented, and secure location (e.g., hard drive, storage device, or the cloud).Maintain offline backups of data,and regularly maintain backup and restoration (daily or weekly at minimum). By instituting this practice, an organization minimizes the impact of disruption to business practices as they will not be as severe and/or only have irretrievable data [CPG 2.R]. Recommend organizations follow the 3-2-1 backup strategy in which organizations have three copies of data (one copy of production data and two backup copies) on two different media such as disk and tape, with one copy kept off-site for disaster recovery.Require all accountswith password logins (e.g., service account, admin accounts, and domain admin accounts)to complywithNIST's standardsfor developing and managing password policies.Use longer passwords consisting of at least 15 characters [CPG 2.B].Store passwords in hashed format using industry-recognized password managers.Add password user “salts” to shared login credentials.Avoid reusing passwords [CPG 2.C].Implement multiple failed login attempt account lockouts [CPG 2.G].Disable password “hints.”Refrain from requiring password changes more frequently than once per year.Note:NIST guidance suggests favoring longer passwords instead of requiring regular and frequent password resets. Frequent password resets are more likely to result in users developing password “patterns” cyber criminals can easily decipher.Require administrator credentials to install software.Require phishing-resistant multifactor authenticationfor all services to the extent possible, particularly for webmail, virtual private networks, and accounts that access critical systems [CPG 2.H].Keep all operating systems, software, and firmware up to date.Timely patching is one of the most efficient and cost-effective steps an organization can take to minimize its exposure to cybersecurity threats. Organizations should patch vulnerable software and hardware systems within 24 to 48 hours of vulnerability disclosure. Prioritize patchingknown exploited vulnerabilitiesin internet-facing systems [CPG 1.E].Segment networksto prevent the spread of ransomware. Network segmentation can help prevent the spread of ransomware by controlling traffic flows between—and access to—various subnetworks, restricting further lateral movement [CPG 2.F].Identify, detect, and investigate abnormal activity and potential traversal of the indicated ransomware with a networking monitoring tool.To aid in detecting ransomware, implement a tool that logs and reports all network traffic, including lateral movement activity on a network. Endpoint detection and response (EDR) tools are particularly useful for detecting lateral connections, as they have insight into common and uncommon network connections for each host [CPG 3.A].Install, regularly update, and enable real time detection for antivirus softwareon all hosts.Disable unusedports[CPG 2.V].Consider adding an email banner to emailsreceived from outside your organization [CPG 2.M].Ensure all backup data is encrypted, immutable(i.e., cannot be altered or deleted), and covers the entire organization’s data infrastructure [CPG 2.K, 2.L, 2.R]."
https://www.cisa.gov/news-events/cybersecurity-advisories/aa23-278a,"MITIGATIONS NETWORK DEFENDERS NSA and CISA recommend network defenders implement the recommendations that follow to mitigate the issues identified in this advisory. These mitigations align with the Cross-Sector Cybersecurity Performance Goals (CPGs) developed by CISA and the National Institute of Standards and Technology (NIST) as well as with theMITRE ATT&CK Enterprise MitigationsandMITRE D3FENDframeworks. The CPGs provide a minimum set of practices and protections that CISA and NIST recommend all organizations implement. CISA and NIST based the CPGs on existing cybersecurity frameworks and guidance to protect against the most common and impactful threats, tactics, techniques, and procedures. Visit CISA’sCross-Sector Cybersecurity Performance Goalsfor more information on the CPGs, including additional recommended baseline protections.[24] SOFTWARE MANUFACTURERS NSA and CISA recommend software manufacturers implement the recommendations in Table 11 to reduce the prevalence of misconfigurations identified in this advisory. These mitigations align with tactics provided in joint guideShifting the Balance of Cybersecurity Risk: Principles and Approaches for Security-by-Design and -Default. NSA and CISA strongly encourage software manufacturers apply these recommendations to ensure their products are secure “out of the box” and do not require customers to spend additional resources making configuration changes, performing monitoring, and conducting routine updates to keep their systems secure.[1]"
https://www.cisa.gov/news-events/cybersecurity-advisories/aa23-263a,"MITIGATIONS The FBI and CISA recommend organizations implement the mitigations below to improve your organization’s cybersecurity posture on the basis of the Snatch threat actor’s activity. These mitigations align with the Cross-Sector Cybersecurity Performance Goals (CPGs) developed by CISA and the National Institute of Standards and Technology (NIST). The CPGs provide a minimum set of practices and protections that CISA and NIST recommend all organizations implement. CISA and NIST based the CPGs on existing cybersecurity frameworks and guidance to protect against the most common and impactful threats, tactics, techniques, and procedures. Visit CISA’sCross-Sector Cybersecurity Performance Goalsfor more information on the CPGs, including additional recommended baseline protections. Reduce threat of malicious actorsusing remote access tools by:Auditing remote access toolson your network to identify currently used and/or authorized software.Reviewing logs for execution of remote access softwareto detect abnormal use of programs running as a portable executable [CPG 2.T].Using security softwareto detect instances of remote access software being loaded only in memory.Requiring authorized remote access solutionsto be used only from within your network over approved remote access solutions, such as virtual private networks (VPNs) or virtual desktop interfaces (VDIs).Blocking both inbound and outbound connectionson common remote access software ports and protocols at the network perimeter.Implement application controlsto manage and control execution of software, including allowlisting remote access programs.Application controls should prevent installation and execution of portable versions of unauthorized remote access and other software. A properly configured application allowlisting solution will block any unlisted application execution. Allowlisting is important because antivirus solutions may fail to detect the execution of malicious portable executables when the files use any combination of compression, encryption, or obfuscation.Strictly limit the use of RDP and other remote desktop services. If RDP is necessary, rigorously apply best practices, for example [CPG 2.W]:Audit the network for systems using RDP.Close unused RDP ports.Enforce account lockouts after a specified number of attempts.Apply phishing-resistant multifactor authentication (MFA).Log RDP login attempts.Disable command-line and scriptingactivities and permissions [CPG 2.N].Review domain controllers, servers, workstations, and active directoriesfor new and/or unrecognized accounts [CPG 4.C].Audit user accounts with administrative privilegesand configure access controls according to the principle of least privilege (PoLP) [CPG 2.E].Reduce the threat of credential compromisevia the following:Place domain admin accounts in the protected users’ groupto prevent caching of password hashes locally.Refrain from storing plaintext credentials in scripts.Implement time-based access for accountsset at the admin level and higher [CPG 2.A, 2.E]. In addition, the authoring authorities of this CSA recommend network defenders apply the following mitigations to limit potential adversarial use of common system and network discovery techniques, and to reduce the impact and risk of compromise by ransomware or data extortion actors: Implement a recovery planto maintain and retain multiple copies of sensitive or proprietary data and servers in a physically separate, segmented, and secure location (i.e., hard drive, storage device, the cloud).Maintain offline backups of dataand regularly maintain backup and restoration (daily or weekly at minimum). By instituting this practice, an organization limits the severity of disruption to its business practices [CPG 2.R].Require all accountswith password logins (e.g., service account, admin accounts, and domain admin accounts)to complywithNIST's standardsfor developing and managing password policies.Use longer passwords consisting of at least eight characters and no more than 64 characters in length [CPG 2.B].Store passwords in hashed format using industry-recognized password managers.Add password user “salts” to shared login credentials.Avoid reusing passwords [CPG 2.C].Implement multiple failed login attempt account lockouts [CPG 2.G].Disable password “hints.”Refrain from requiring password changes more frequently than once per year.Note:NIST guidance suggests favoring longer passwords instead of requiring regular and frequent password resets. Frequent password resets are more likely to result in users developing password “patterns” cyber criminals can easily decipher.Require administrator credentials to install software.Require phishing-resistant multifactor authentication (MFA)for all services to the extent possible, particularly for webmail, virtual private networks (VPNs), and accounts that access critical systems [CPG 2.H].Keep all operating systems, software, and firmware up to date.Timely patching is one of the most efficient and cost-effective steps an organization can take to minimize its exposure to cybersecurity threats. Prioritize patchingknown exploited vulnerabilitiesin internet-facing systems [CPG 1.E].Segment networksto prevent the spread of ransomware. Network segmentation can help prevent the spread of ransomware by controlling traffic flows between—and access to—various subnetworks and by restricting adversary lateral movement [CPG 2.F].Identify, detect, and investigate abnormal activity and potential traversal of the indicated ransomware with a networking monitoring tool.To aid in detecting the ransomware, implement a tool that logs and reports all network traffic and activity, including lateral movement, on a network. Endpoint detection and response (EDR) tools are particularly useful for detecting lateral connections as they have insight into common and uncommon network connections for each host [CPG 3.A].Install, regularly update, and enable real time detection for antivirus softwareon all hosts.Disable unusedports and protocols[CPG 2.V].Consider adding an email banner to emailsreceived from outside your organization [CPG 2.M].Disable hyperlinksin received emails.Ensure all backup data is encrypted, immutable(i.e., ensure backup data cannot be altered or deleted), and covers the entire organization’s data infrastructure [CPG 2.K, 2.L, 2.R]."
https://www.cisa.gov/news-events/cybersecurity-advisories/aa23-250a,"MITIGATIONS Note:These mitigations align with the Cross-Sector Cybersecurity Performance Goals (CPGs) developed by CISA and the National Institute of Standards and Technology (NIST). The CPGs provide a minimum set of practices and protections that CISA and NIST recommend all organizations implement. CISA and NIST based the CPGs on existing cybersecurity frameworks and guidance to protect against the most common and impactful threats, tactics, techniques, and procedures. Visit CISA’sCross-Sector Cybersecurity Performance Goalsfor more information on the CPGs, including additional recommended baseline protections. MANAGE VULNERABILITIES AND CONFIGURATIONS [CPG 1.E, CPG 3.A] CISA and co-sealers identified that exploitation of CVE-2022-47966 granted initial access to the public-facing application, Zoho ManageEngine ServiceDesk Plus. Multiple Zoho ManageEngine on-premises products, such as ServiceDesk Plus through 14003, allow remote code execution due to use of version 1.4.1 of Apache XML Security for Java (also known as xmlsec) from the Apache Santuario project. Due to the xmlsec XSLT features by design in that version, the application is responsible for certain security protections. CISA and co-sealers recommend the following: Document device configurations[CPG 2.O].Organizations should maintain updated documentation describing the current configuration details of all critical IT assets (and OT, where applicable), as this facilitates more effective vulnerability and response activities.Keep all software up to date and patch systems for known exploited vulnerabilities.In places with known exploited vulnerabilities on an endpoint device (e.g., firewall security appliances), conduct investigation prior to patching [CPG 1.E].Follow a routine patching cycle[M1051] for all operating systems, applications, and software (including all third-party software) to mitigate the potential for exploitation.Prioritize remediation of vulnerabilities on internet-facing systems,for example, by conducting continuous automated and/or routine vulnerability scans [M1016]. CISA offers a range of services at no cost, including scanning and testing to help organizations reduce exposure to threats via mitigating attack vectors. Specifically,Cyber Hygieneservices can help provide a second-set of eyes on organizations' internet-accessible assets. Organizations can emailvulnerability@cisa.dhs.govwith the subject line, “Requesting Cyber Hygiene Services” to get started. For additional guidance on remediating these vulnerabilities, seeCISA Insights - Remediate Vulnerabilities for Internet-Accessible Systems.Deploy security.txt files[CPG 4.C].All public-facing web domains have a security.txt file that conforms to the recommendations in RFC 9116.[9] SEGMENT NETWORKS [CPG 2.F] CISA and co-sealers identified that the organization did not employ proper network segmentation, such as a demilitarized zone (DMZ), during the initial discovery phase of the incident response. A DMZ serves as a perimeter network that protects and adds an extra layer of security to an organization’s internal local area network (LAN) from untrusted traffic. Employ proper network segmentation, such as a DMZ,and ensure to address the following recommendations.Note:The end goal of a DMZ network is to allow an organization to access untrusted networks, such as the internet, while ensuring its private network or LAN remains secure. Organizations typically store external-facing services and resources, as well as servers for DNS, File Transfer Protocol (FTP), mail, proxy, Voice over Internet Protocol (VoIP), and web servers in the DMZ [CPG 2.K,CPG 2.W].Limit internet-facing port exposure for critical resources in the DMZ networks.Limit exposed ports to only required IP addresses and avoid placing wildcards in destination port or host entries.Ensure unsecured protocols like FTP and HTTP are limited in use and restricted to specific IP ranges.If data flows from untrusted zone to trusted zone, ensure it is conducted over a secure protocol like HTTPS with mandatory multi-factor authentication.Use a firewall or web-application firewall (WAF) and enable loggingto prevent/detect potential exploitation attempts [M1050]. Review ingress and egress firewall rules and block all unapproved protocols. Limit risky (but approved) protocols through rules.Use WAF to limit exposure to just approved ports, as well as monitor file changes in web directories.Implement network segmentation to separate network segments based on role and functionality.Proper network segmentation significantly reduces the ability for threat actor lateral movement by controlling traffic flows between—and access to—various subnetworks. See CISA’sLayering Network Security Through Segmentationinfographic and the National Security Agency’s (NSA’s)Segment Networks and Deploy Application-Aware Defenses. MANAGE ACCOUNTS, PERMISSIONS, AND WORKSTATIONS APT actors were able to leverage disabled administrative accounts, as well as clear logs on several critical servers, which prevented the ability to detect follow-on exploitation or data exfiltration. CISA and co-sealers recommend the following: Use phishing-resistant multi-factor authentication (MFA)[CPG 2.H] (e.g., security tokens) for remote access and access to any sensitive data repositories. Implement phishing-resistant MFA for as many services possible—particularly for webmail and VPNs—for accounts that access critical systems and privileged accounts that manage backups.MFA should also be used for remote logins [M1032]. For additional guidance on secure MFA configurations, visitcisa.gov/MFAand CISA’sImplementing Phishing-Resistant MFAFactsheet.Employ strong password managementalongside other attribute-based information, such as device information, time of access, user history, and geolocation data. Set a password policy to require complex passwords for all users (minimum of 16 characters) and enforce this new requirement as users’ passwords expire [CPG 2.A,CPG 2.B,CPG 2.C].Implement the principle of least privilegeto decrease threat actors’ abilities to access key network resources.Limit the ability of a local administrator account to log in from a local interactive session[CPG 2.E] (e.g., “Deny access to this computer from the network”) and prevent access via an RDP session.Establish policy and procedure for the prompt removal of unnecessary (disabled) accountsand groups from the enterprise that are no longer needed, especially privileged accounts. Implement and enforce use of Local Administrator Password Solution (LAPS).Control and limit local administration,ensuring administrative users do not have access to other systems outside of the local machine and across the domain.Create a change control processfor all privilege escalations and role changes on user accounts. Enable alerts on privilege escalations and role changes, as well as log privileged user changes in the network environment and create alerts for abnormal events.Create and deploy a secure system baseline image to all workstations.See Microsoft’s guidance onUsing Security Baselines in Your Organization.Implement policies to block workstation-to-workstation RDP connections[CPG 2.V] through a Group Policy Object on Windows, or by a similar mechanism. The RDP service should be disabled if it is unnecessary [M1042]. SECURE REMOTE ACCESS SOFTWARE Remote access software provides a proactive and flexible approach for organizations to internally oversee networks, computers, and other devices; however, cyber threat actors increasingly co-opt these tools for access to victim systems. APT actors were observed using legitimate remote access tools—ConnectWise ScreenConnectandAnyDesk—to connect to victim hosts within the organization’s environment and further conduct malicious operations. CISA and co-sealers recommend the following: Establish a software behavior baselineto detect anomalies in behavior [CPG 2.T,CPG 2.U].Monitor for unauthorized use of remote access softwareusing endpoint detection tools. For more information, see CISA’s jointGuide to Securing Remote Access Softwareon best practices for using remote capabilities and how to detect and defend against malicious actors abusing this software. OTHER BEST PRACTICE MITIGATION RECOMMENDATIONS Use application allowlistson domain controllers, administrative hosts, and other sensitive systems. Following exploitation of the public-facing application (Zoho ManageEngine ServiceDesk Plus), APT actors were able to download and execute multiple files on the system, which were then utilized to enumerate the network and perform reconnaissance operations.Use directory allowlistingrather than attempting to list every possible permutation of applications in a network environment. Safe defaults allow applications to run fromPROGRAMFILES,PROGRAMFILES(X86), andSYSTEM32. Disallow all other locations unless an exception is granted and documented. Application directory allowlisting can be enabled through Microsoft Software Restriction Policy or AppLocker and can prevent the execution of unauthorized software.Audit scheduled tasks and validate all findingsvia a Group Policy Object (GPO) or endpoint detection and response (EDR) solution.Follow Microsoft’sBest Practices for Securing Active Directory.Review NSA’sNetwork Infrastructure Security Guide."
