URL,Content
https://www.cisa.gov/news-events/cybersecurity-advisories/aa23-208a,"MITIGATIONS VENDORS AND DEVELOPERS ACSC, CISA, and NSA recommend that vendors, designers, and implementors of web applications—including organizations that build and deploy software (such as HR tools) for their internal use and organizations that create open-source projects—implement the following mitigations. These mitigations may reduce prevalence of IDOR vulnerabilities in software and help ensure products are secure-by-design and -default. Implement and injectsecure-by-design and -default principlesand best practices into each stage of the software development life cycle (SDLC). Particular recommended practices are defined in the National Institute of Security and Technology’s (NIST’s) Secure Software Development Framework (SSDF),SP 800-218. Lend special attention to:Conducting code reviews[SSDF PW 7.2, RV 1.2] against peer coding standards, checking for backdoors, malicious content, or logic flaws.ACSC, CISA, and NSA recommend using automated code analysis tools for all supported releases to identify and remediate vulnerabilities.Following secure coding practices[SSDF PW 5.1] for web and mobile applications to ensure that they properly validate user input and generate strong user IDs.Use indirect reference maps, such that IDs, names, and keys are not exposed in URLs. Replace them with cryptographically strong, random values—specifically use a UUID or a GUID.Note:UUIDs and GUIDs should not be used for security capabilities. SeeRequest for Comment (RFC) 4122for more information.Configure applications to deny access by default and ensure the application performs authentication and authorization checksfor every request to modify data, delete data, and access sensitive data. For example:Normalize requests. There are many ways to encode and decode web inputs. Decode and normalize inputs before creating access control checkpoints. Ensure the access control system and other parts of the web application perform the same normalization.Implement parameter verificationleveraging syntactic and logical validation, such that web applications validate all inputs received with every HTTP/S request. Denying invalid requests can reduce the burden on the access control system.Syntactic validation verifies that for each input the incoming value meets your applications’ expectations. When doing syntactic validation, verify that strings are within the minimum and maximum length required, strings do not contain unacceptable characters, numeric values are within the minimum and maximum boundaries, and the input is of the proper data type.Logical validation adds checks to see if the input values make sense and are consistent with design intent. When doing logical validation, verify authorization checks are performed in the correct locations, are of varying pedigree, and that there is error handling of failed authentication and authorization requests.Use CAPTCHA to limit automated invalid user requestswhere feasible.Use memory-safe programming languageswhere possible.Testing codeto identify vulnerabilities and verify compliance with security requirements [SSDF PW 8.2].Use automated testing tools to facilitate testing,fuzz testingtools to find issues with input handling,[8] and penetration testing to simulate how a threat actor may exploit the software. Consider using dynamic application security testing (DAST) tools to identify IDOR vulnerabilities in web applications.Conducting role-based training[SSDF PO 2.2] for personnel responsible for secure software development.Exercising due diligence when selecting third-party libraries or frameworksto incorporate into your application [SSDF PW 4.1].Review and evaluate third-party components in the context of their expected use.Verify the integrity of the product through hash or signature verification.If provided, review component’sSoftware Bill of Materials (SBOM)for outdated, vulnerable, or unauthorized applications before using it.Keep all third-party frameworks and dependencies up to date to limit vulnerability inheritance.Note:Organizations should maintain an inventory or catalog of third-party frameworks and dependencies to assist with proactive updates. Consider using tools to identify project dependencies and known vulnerabilities in third-party code. See OWASP’s Top Ten Proactive Controls 2018,C2: Leverage Security Frameworks and Libraries, for more information.For more information, see the joint Enduring Security Framework’s Securing the Software Supply Chain:Recommended Practices Guide for Developers, CISA’sSupply Chain Risk Management Essentials, and ACSC’sCyber Supply Chain Risk Management.Establish avulnerability disclosure programto verify and resolve security vulnerabilities disclosed by people who may be internal or external to the organization. Additionally, ACSC, CISA, and NSA recommendfollowing cybersecurity best practicesin production and enterprise environments. Software developers are high-value targets because their customers deploy software on their own trusted networks. For best practices, see: ACSC’sEssential Eight. The Essential Eight are prioritized strategies to help cybersecurity professionals mitigate cybersecurity incidents caused by various cyber threats.CISA’sCross-Sector Cybersecurity Performance Goals(CPGs). The CPGs, developed by CISA and NIST, are a prioritized subset of IT and OT security practices that can meaningfully reduce the likelihood and impact of known cyber risks and common tactics, techniques, and procedures. Because the CPGs are a subset of best practices, ACSC, CISA, and NSA also recommend software manufacturers implement a comprehensive information security program based on a recognized framework, such as theNIST Cybersecurity Framework (CSF).NSA’sTop Ten Cybersecurity Mitigations. The Top Ten sets priorities for enterprise activities to counter a broad range of exploitation techniques and minimize mission impact. ALL END-USER ORGANIZATIONS ACSC, CISA, and NSA recommend that all end-user organizations, including those with on-premises software, SaaS, IaaS, and private cloud models, implement the mitigations below to improve their cybersecurity posture. Exercise due diligence when selecting web applications. Follow best practices for supply chain risk management and source from reputable vendors that demonstrate commitment to secure-by-design and -default principles.Verify the integrity of the product through hash or signature verification.If provided, review theSBOMfor outdated, vulnerable, or unauthorized applications before using the product.For more information, see the Enduring Security Framework’sSecuring the Software Supply Chain: Recommended Practices Guide for Customers, CISA’sSupply Chain Risk Management Essentials, and ACSC’sCyber Supply Chain Risk Management.Apply software patches for web applicationsas soon as possible.Configure the application to log and generate alerts from tamper attempts—with this information, network defenders can investigate and take appropriate follow-on actions.Establish a baseline to efficiently identify abnormal behavior.Note:Web application error codes such asHTTP 404andHTTP 403are associated with common enumeration techniques.Aggregate logs into a centralized solution (e.g., a security information and event management [SIEM] tool) to facilitate active monitoring and threat hunting.Create, maintain, and exercise a basic cyber incident response plan (IRP) and associated communications plan. Plans should include response and notification procedures for data breach and cyber incidents. For more information, see:ACSC:Preparing for and Responding to Cyber IncidentsACSC:Cyber Incident Response Plan - GuidanceACSC:Cyber Incident Response Readiness ChecklistOffice of the Australian Information Commissioner (OAIC):Data Breach Preparation and ResponseOIAC:Data Breach Response PlanCISA:Incident Response Plan BasicsCISA:Federal Government Cybersecurity Incident and Vulnerability Response Playbook(Although tailored to U.S. Federal Civilian Branch (FCEB) agencies, these playbooks provide operational procedures for planning and conducting cybersecurity incident and vulnerability response activities and detail steps for both incident and vulnerability response.)CISA:Protecting Sensitive and Personal Information from Ransomware-Caused Data Breaches Additionally, ACSC, CISA, and NSA recommendfollowing cybersecurity practices. For best practices, see ACSC’sEssential Eight, CISA’sCPGs, and NSA’s Top Ten Cybersecurity Mitigation Strategies. END-USER ORGANIZATIONS WITH ON-PREMISES SOFTWARE, IAAS, OR PRIVATE CLOUD MODELS ACSC, CISA, and NSA recommend that organizations: Conduct regular, proactive penetration testingto ensure network boundaries, as well as web applications, are secure. Prioritize web applications that are internet-facing and contain user login functionality. Such testing may be beyond the technical or financial capabilities of some organizations. Consider using a trusted third party for penetration testing to discover new attack vectors (notably prior to deployment of new or altered internet-facing services).Note:Organizations should consult with their legal counsel as appropriate to determine which systems and applications can be included in the scope of the penetration testing.Use web application penetration testing toolsto capture the user identifier sent to the web server when requesting a web page containing sensitive data and map all locations where user input is used to reference objects directly. Test with users of various privilege levels (e.g., a normal user and admin user).Use DAST and other vulnerability scannersto detect IDOR vulnerabilities. DAST tools identify vulnerabilities in web applications with penetration tests and generate automated alerts.Note:Exercise due diligence when selecting DAST tools. Not all DAST tools can detect IDOR vulnerabilities—tools with the ability may need the environment configured in a specific way and may also need custom rules in place. Sufficient DAST tools often ingest the application API documentation to build a model of the application. While these tools can be used to detect IDOR vulnerabilities, they are not foolproof and should be used with other security testing methods to ensure comprehensive coverage.Immediately report detected vulnerabilities to the vendor or developer. Alternatively (or if the vendor or developer fails to respond), report the vulnerability to CISA atcisa.gov/report.Consider establishing avulnerability disclosure programto verify, resolve, and report security vulnerabilities disclosed by people who may be internal or external to the organization.Use a web application firewall (WAF)to filter, monitor, and block malicious HTTP/S traffic traveling to the web application.Use a data loss prevention (DLP) tool toprevent unauthorized data from leaving the application. ACSC, CISA, and NSA recommend that organizations with on-premises software or IaaS consider using SaaS models for their internet-facing websites. END-USER ORGANIZATIONS WITH SAAS MODELS Organizations leveraging SaaS with sufficient resources may consider conducting penetration testing and using vulnerability scanners. However, such tests may interfere with service provider operations. Organizations should consult with their legal counsel as appropriate to determine what can be included in the scope of the penetration testing."
https://www.cisa.gov/news-events/cybersecurity-advisories/aa23-201a,"MITIGATIONS CISA recommends all organizations: Install the relevant updated version of NetScaler ADC and NetScaler Gatewayas soon as possible. SeeCitrix ADC and Citrix Gateway Security Bulletin for CVE-2023-3519, CVE-2023-3466, CVE-2023-3467for patch information.Follow best cybersecurity practicesin your production and enterprise environments, including mandatingphishing-resistant multifactor authentication (MFA)for all staff and for all services. For additional best practices, see CISA’sCross-Sector Cybersecurity Performance Goals(CPGs). The CPGs, developed by CISA and the National Institute of Standards and Technology (NIST), are a prioritized subset of information technology (IT) and operational technology (OT) security practices that can meaningfully reduce the likelihood and impact of known cyber risks and common TTPs. Because the CPGs are a subset of best practices, CISA and ACSC also recommend software manufacturers implement a comprehensive information security program based on a recognized framework, such as the NIST Cybersecurity Framework (CSF).As a longer-term effort,apply robust network-segmentation controls on NetScaler appliances, and other internet-facing devices. "
https://www.cisa.gov/news-events/cybersecurity-advisories/aa23-193a,"GENERAL CLOUD MITIGATIONS All mitigation actions for this activity are the responsibility of Microsoft due to the cloud-based infrastructure affected; however, CISA and the FBI recommend that critical infrastructure organizations implement the following to harden their cloud environments. Although, these mitigations will not prevent this or related activity where actors leverage compromised consumer keys, they will reduce the impact of less sophisticated malicious activity targeting cloud environments.Note:These mitigations align with CISA’sSCuBA Technical Reference Architecture (TRA), which describes essential components of security services and capabilities to secure and harden cloud business applications, including the platforms hosting the applications. Apply CISA’s recommended baseline security configurationsfor MicrosoftDefender for Office 365,Azure Active Directory,Exchange Online,OneDrive for Business,Power BI,Power Platform,SharePoint Online, andTeams[SCuBA TRA Section 6.6].Separate administrator accounts from user accountsaccording to the National Institute of Standards and Technology’s (NIST’s) guidance,AC-5: Separation of Duties. Only allow designated administrator accounts to be used for administration purposes. If an individual user requires administrative rights over their workstation, use a separate account without administrative access to other hosts.Collect and store access and security logsfor secure cloud access (SCA) solutions, endpoint solutions, cloud applications/platforms and security services, such as firewalls, data loss prevention systems, and intrusion detection systems [SCuBA TRA Section 6.8.1].Use a telemetry hosting solution(e.g., SIEM solution) that aggregates logs and telemetry data to facilitate internal organization monitoring, auditing, alerting, and threat detection activities [SCuBA TRA Section 6.8.1].Review contractual relationships with all Cloud Service Providers (CSPs)and ensure contracts include:Security controls the customer deems appropriate.Appropriate monitoring and logging of provider-managed customer systems.Appropriate monitoring of the service provider’s presence, activities, and connections to the customer network.Notification of confirmed or suspected activity."
https://www.cisa.gov/news-events/cybersecurity-advisories/aa23-187a,"MITIGATIONS CISA and the authoring organizations recommend organizations implement the below mitigations, including mandatingphishing-resistant multifactor authentication (MFA)for all staff and services. For additional best practices, see CISA’sCross-Sector Cybersecurity Performance Goals(CPGs). The CPGs, developed by CISA and the National Institute of Standards and Technology (NIST), are a prioritized subset of IT and OT security practices that can meaningfully reduce the likelihood and impact of known cyber risks and common TTPs. Because the CPGs are a subset of best practices, CISA and co-sealers recommend software manufacturers implement a comprehensive information security program based on a recognized framework, such as the NISTCybersecurity Framework(CSF). Apply patches to CVE-2022-31199Update Netwrix Auditor toversion 10.5 Netwrix recommends using their Auditor application only on internally facing networks. System owners that don't follow this recommendation, and use the application in externally facing instances, are at increased risk to having CVE-2022-31199 exploited on their systems. Reduce threat of malicious actors using remote access tools by: Implementing application controls to manage and control execution of software, including allowlisting remote access programs.Application controls should prevent installation and execution of portable versions of unauthorized remote access and other software. A properly configured application allowlisting solution will block any unlisted application execution. Allowlisting is important because antivirus solutions may fail to detect the execution of malicious portable executables when the files use any combination of compression, encryption, or obfuscation. See the National Security Agency’s Cybersecurity Information sheet,Enforce Signed Software Execution Policies, and additional guidance below: Strictly limit the use of RDP and other remote desktop services. If RDP is necessary, rigorously apply best practices, for example [CPG 2.W]:Audit the network for systems using RDP.Close unused RDP ports.Enforce account lockouts after a specified number of attempts.Apply phishing-resistant multifactor authentication (MFA).Log RDP login attempts.Disable command-line and scripting activities and permissions[CPG 2.N].Restrict the use of PowerShell by using Group Policy, and only grant to specific users on a case-by-case basis. Typically, only those users or administrators who manage the network or Windows operating systems (OSs) should be permitted to use PowerShell [CPG 2.E].Update Windows PowerShell or PowerShell Coreto the latest version and uninstall all earlier PowerShell versions. Logs from Windows PowerShell prior to version 5.0 are either non-existent or do not record enough detail to aid in enterprise monitoring and incident response activities [CPG 1.E, 2.S, 2.T].Enable enhanced PowerShell logging[CPG 2.T, 2.U].PowerShell logs contain valuable data, including historical OS and registry interaction and possible IOCs of a cyber threat actor’s PowerShell use.Ensure PowerShell instances, using the latest version, have module, script block, and transcription logging enabled (enhanced logging).The two logs that record PowerShell activity are the PowerShell Windows Event Log and the PowerShell Operational Log. The authoring organizations recommend turning on these two Windows Event Logs with a retention period of at least 180 days. These logs should be checked on a regular basis to confirm whether the log data has been deleted or logging has been turned off. Set the storage size permitted for both logs to as large as possible.Configure the Windows Registry to require User Account Control (UAC) approval for any PsExec operationsrequiring administrator privileges to reduce the risk of lateral movement by PsExec.Review domain controllers, servers, workstations, and active directoriesfor new and/or unrecognized accounts [CPG 4.C].Audit user accountswith administrative privileges and configure access controls according to the principle of least privilege (PoLP) [CPG 2.E].Reduce the threat of credential compromise via the following:Place domain admin accounts in the protected users’ groupto prevent caching of password hashes locally.Implement Credential Guard for Windows 10 and Server 2016(Refer toMicrosoft: Manage Windows Defender Credential Guardfor more information). For Windows Server 2012R2, enable Protected Process Light for Local Security Authority (LSA).Refrain from storing plaintext credentials in scripts.Implement time-based access for accounts set at the admin level and higher[CPG 2.A, 2.E]. For example, the Just-in-Time (JIT) access method provisions privileged access when needed and can support enforcement of the principle of least privilege (as well as theZero Trustmodel). This is a process where a network-wide policy is set in place to automatically disable admin accounts at the Active Directory (AD) level when the account is not in direct need. Individual users may submit their requests through an automated process that grants them access to a specified system for a set timeframe when they need to support the completion of a certain task. In addition, CISA, FBI, MS-ISAC, and CCCS recommend network defenders apply the following mitigations to limit potential adversarial use of common system and network discovery techniques and to reduce the impact and risk of compromise by ransomware or data extortion actors: Disable File and Printer sharing services. If these services are required, use strong passwords or Active Directory authentication.Implement a recovery planto maintain and retain multiple copies of sensitive or proprietary data and servers in a physically separate, segmented, and secure location (e.g., hard drive, storage device, or the cloud).Maintain offline backups of dataand regularly maintain backup and restoration (daily or weekly at minimum). By instituting this practice, an organization minimizes the impact of disruption to business practices as they can retrieve their data [CPG 2.R].Require all accountswith password logins (e.g., service account, admin accounts, and domain admin accounts)to complywithNational Institute for Standards and Technology (NIST) standardsfor developing and managing password policies.Use longer passwords consisting of at least 15 characters [CPG 2.B].Store passwords in hashed format using industry-recognized password managers.Add password user “salts” to shared login credentials.Avoid reusing passwords [CPG 2.C].Implement multiple failed login attempt account lockouts [CPG 2.G].Disable password “hints.”Refrain from requiring password changes more frequently than once per year.Note:NIST guidance suggests favoring longer passwords instead of requiring regular and frequent password resets. Frequent password resets are more likely to result in users developing password “patterns” cyber criminals can easily decipher.Require administrator credentials to install software.Require phishing-resistant multifactor authenticationfor all services to the extent possible, particularly for webmail, virtual private networks, and accounts that access critical systems [CPG 2.H].Keep all operating systems, software, and firmware up to date. Timely patching is one of the most efficient and cost-effective steps an organization can take to minimize its exposure to cybersecurity threats. Organizations should patch vulnerable software and hardware systems within 24 to 48 hours of vulnerability disclosure. Prioritize patching known exploited vulnerabilities in internet-facing systems [CPG 1.E].Segment networksto prevent the spread of ransomware. Network segmentation can help prevent the spread of ransomware by controlling traffic flows between—and access to various subnetworks, restricting further lateral movement [CPG 2.F].Identify, detect, and investigate abnormal activity and potential traversal of the indicated ransomware with a networking monitoring tool. To aid in detecting ransomware, implement a tool that logs and reports all network traffic, including lateral movement activity on a network. Endpoint detection and response (EDR) tools are particularly useful for detecting lateral connections, as they have insight into common and uncommon network connections for each host [CPG 3.A].Install, regularly update, and enable real time detection for antivirus softwareon all hosts.Disable unused ports[CPG 2.V].Consider adding an email banner to emailsreceived from outside your organization [CPG 2.M].Ensure all backup data is encrypted, immutable(i.e., cannot be altered or deleted), and covers the entire organization’s data infrastructure [CPG 2.K, 2.L, 2.R]."
