URL,Content
https://www.cisa.gov/news-events/ics-advisories/icsa-25-023-05,"4. MITIGATIONS Schneider Electric has the following remediations for users to apply. Please reboot the system after installing the new version: EcoStruxure Power Build Rapsody Versions v2.5.2 NL and prior:Version NL v2.7.2includes a fix for this vulnerability and is available for download.EcoStruxure Power Build Rapsody Versions v2.7.1 FR and prior:Version FR v2.7.12includes a fix for this vulnerability and is available for download.EcoStruxure Power Build Rapsody Versions v2.7.5 ES and prior:Version ES v2.7.52includes a fix for this vulnerability and is available for download.EcoStruxure Power Build Rapsody Versions v2.5.4 INT and prior: Schneider Electric is establishing a remediation plan for all future versions of EcoStruxure Power Build Rapsody INT version that will include a fix for this vulnerability. Schneider Electric will update SEVD-2025-014-09 when the remediation is available. Until installing the new version, users should immediately apply the following mitigations to reduce the risk of exploit: Only open projects from trusted sources.Ensure use of malware scans before opening any externally created project.Encrypt project file when stored and restrict the access to only trusted users.When exchanging files over the network, use secure communication protocols.Compute a hash of the project files and regularly check the consistency of this hash to verify the integrity before usage. For more information refer to theSchneider Electric Recommended cybersecurity best practices documentand the associated Schneider Electric security notification SEVD-2025-014-09 inPDFandCSAF. To ensure users are informed of all updates, including details on affected products and remediation plans, subscribe toSchneider Electric's security notification service. CISA recommends users take defensive measures to minimize the risk of exploitation of this vulnerability. CISA reminds organizations to perform proper impact analysis and risk assessment prior to deploying defensive measures. CISA also provides a section forcontrol systems security recommended practiceson the ICS webpage oncisa.gov. Several CISA products detailing cyber defense best practices are available for reading and download, includingImproving Industrial Control Systems Cybersecurity with Defense-in-Depth Strategies. CISA encourages organizations to implement recommended cybersecurity strategies forproactive defense of ICS assets. Additional mitigation guidance and recommended practices are publicly available on the ICS webpage atcisa.govin the technical information paper,ICS-TIP-12-146-01B--Targeted Cyber Intrusion Detection and Mitigation Strategies. Organizations observing suspected malicious activity should follow established internal procedures and report findings to CISA for tracking and correlation against other incidents. No known public exploitation specifically targeting this vulnerability has been reported to CISA at this time. This vulnerability is not exploitable remotely."
https://www.cisa.gov/news-events/ics-advisories/icsa-25-023-06,"4. MITIGATIONS To ensure the highest level of security when using the Ewon Flexy device, HMS strongly recommend following these best practices: Integrate with Talk2M Cloud: Always use the Flexy device in conjunction with Talk2M cloud. This guarantees a robust security level for your remote access connections.Follow the the guidelines outlined here:Best Practices for Secure Usage of the Ewon SolutionDisable Unused Protocols: Regularly review and disable any unsecure protocols that are not in use. Learn how to do this here:How to Block Unused Ewon Services For further information, please visit the HMSSecurity Advisoriespage. CISA recommends users take defensive measures to minimize the risk of exploitation of this vulnerability, such as: Minimize network exposure for all control system devices and/or systems, ensuring they arenot accessible from the internet.Locate control system networks and remote devices behind firewalls and isolating them from business networks.When remote access is required, use more secure methods, such as Virtual Private Networks (VPNs), recognizing VPNs may have vulnerabilities and should be updated to the most current version available. Also recognize VPN is only as secure as the connected devices. CISA reminds organizations to perform proper impact analysis and risk assessment prior to deploying defensive measures. CISA also provides a section forcontrol systems security recommended practiceson the ICS webpage oncisa.gov/ics. Several CISA products detailing cyber defense best practices are available for reading and download, includingImproving Industrial Control Systems Cybersecurity with Defense-in-Depth Strategies. CISA encourages organizations to implement recommended cybersecurity strategies forproactive defense of ICS assets. Additional mitigation guidance and recommended practices are publicly available on the ICS webpage atcisa.gov/icsin the technical information paper,ICS-TIP-12-146-01B--Targeted Cyber Intrusion Detection and Mitigation Strategies. Organizations observing suspected malicious activity should follow established internal procedures and report findings to CISA for tracking and correlation against other incidents. CISA also recommends users take the following measures to protect themselves from social engineering attacks: Do not click web links or open attachments in unsolicited email messages.Refer toRecognizing and Avoiding Email Scamsfor more information on avoiding email scams.Refer toAvoiding Social Engineering and Phishing Attacksfor more information on social engineering attacks. No known public exploitation specifically targeting this vulnerability has been reported to CISA at this time."
https://www.cisa.gov/news-events/ics-advisories/icsa-25-021-01,"4. MITIGATIONS After consulting with the Federal Aviation Administration (FAA) and the researchers regarding these vulnerabilities, it has been concluded that CVE-2024-11166 can be fully mitigated by upgrading to ACAS X or by upgrading the associated transponder to comply with RTCA DO-181F. Currently, there is no mitigation available for CVE-2024-9310. These vulnerabilities in the TCAS II standard are exploitable in a lab environment. However, they require very specific conditions to be met and are unlikely to be exploited outside of a lab setting. Organizations observing suspected malicious activity should follow established internal procedures and report findings to CISA for tracking and correlation against other incidents. No known public exploitation specifically targeting these vulnerabilities has been reported to CISA at this time. These vulnerabilities are not exploitable remotely. These vulnerabilities have a high attack complexity."
https://www.cisa.gov/news-events/ics-advisories/icsa-25-021-02,"4. MITIGATIONS Siemens has released new versions for the affected products and recommends updating to the latest versions: SIMATIC S7-1200 CPU:Update to V4.7 or later version.SIPLUS S7-1200 CPU:Update to V4.7 or later version. Siemens has identified the following specific workarounds and mitigations users can apply to reduce risk: Do not click on links from untrusted sources. As a general security measure, Siemens recommends protecting network access to devices with appropriate mechanisms. To operate the devices in a protected IT environment, Siemens recommends configuring the environment according toSiemens' operational guidelines for industrial securityand following recommendations in the product manuals. Additional information on industrial security by Siemens can be found on theSiemens industrial security webpage For more information see the associated Siemens security advisory SSA-717113 inHTMLandCSAF. CISA recommends users take defensive measures to minimize the risk of exploitation of this vulnerability. CISA reminds organizations to perform proper impact analysis and risk assessment prior to deploying defensive measures. CISA also provides a section forcontrol systems security recommended practiceson the ICS webpage oncisa.gov. Several CISA products detailing cyber defense best practices are available for reading and download, includingImproving Industrial Control Systems Cybersecurity with Defense-in-Depth Strategies. CISA encourages organizations to implement recommended cybersecurity strategies forproactive defense of ICS assets. Additional mitigation guidance and recommended practices are publicly available on the ICS webpage atcisa.govin the technical information paper,ICS-TIP-12-146-01B--Targeted Cyber Intrusion Detection and Mitigation Strategies. Organizations observing suspected malicious activity should follow established internal procedures and report findings to CISA for tracking and correlation against other incidents. CISA also recommends users take the following measures to protect themselves from social engineering attacks: Refer toRecognizing and Avoiding Email Scamsfor more information on avoiding email scams.Refer toAvoiding Social Engineering and Phishing Attacksfor more information on social engineering attacks. No known public exploitation specifically targeting this vulnerability has been reported to CISA at this time."
https://www.cisa.gov/news-events/ics-advisories/icsa-25-021-03,"4. MITIGATIONS To most effectively mitigate general vulnerabilities of the powerline communication, any trucks, trailers, and tractors utilizing J2497 technology should disable all features where possible, except for backwards-compatibility with LAMP ON detection only. Users acquiring new trailer equipment should migrate all diagnostics to newer trailer bus technology. Users acquiring new tractor equipment should remove support for reception of any J2497 message other than LAMP messages. ZF recommends: Moving away from security access and implementing the latest security feature authenticate (0x29)Ensure random numbers are generated from a cryptographically secure hardware true random number generatorAdopting modern standards/protocols for truck trailer communication NMFTA has published detailed information about how to mitigate these issues in the following ways: Install a LAMP ON firewall for each ECUUse a LAMP detect circuit LAMP ON sender with each trailerChange addresses dynamically on each tractor in response to detecting a transmitter on its current address.Install RF chokes on each trailer between chassis ground and wiring groundLoad with LAMP keyhole signal on each tractorFlood with jamming signal on each tractor Please visitNMFTAfor additional details on these and other solutions. CISA recommends users take defensive measures to minimize the risk of exploitation of this vulnerability, such as: Minimize network exposure for all control system devices and/or systems, ensuring they arenot accessible from the internet.Locate control system networks and remote devices behind firewalls and isolating them from business networks.When remote access is required, use more secure methods, such as Virtual Private Networks (VPNs), recognizing VPNs may have vulnerabilities and should be updated to the most current version available. Also recognize VPN is only as secure as the connected devices. CISA reminds organizations to perform proper impact analysis and risk assessment prior to deploying defensive measures. CISA also provides a section forcontrol systems security recommended practiceson the ICS webpage oncisa.gov/ics. Several CISA products detailing cyber defense best practices are available for reading and download, includingImproving Industrial Control Systems Cybersecurity with Defense-in-Depth Strategies. CISA encourages organizations to implement recommended cybersecurity strategies forproactive defense of ICS assets. Additional mitigation guidance and recommended practices are publicly available on the ICS webpage atcisa.gov/icsin the technical information paper,ICS-TIP-12-146-01B--Targeted Cyber Intrusion Detection and Mitigation Strategies. Organizations observing suspected malicious activity should follow established internal procedures and report findings to CISA for tracking and correlation against other incidents. CISA also recommends users take the following measures to protect themselves from social engineering attacks: Do not click web links or open attachments in unsolicited email messages.Refer toRecognizing and Avoiding Email Scamsfor more information on avoiding email scams.Refer toAvoiding Social Engineering and Phishing Attacksfor more information on social engineering attacks. No known public exploitation specifically targeting this vulnerability has been reported to CISA at this time."
https://www.cisa.gov/news-events/ics-advisories/icsa-25-016-01,"4. MITIGATIONS Siemens has identified the following specific workarounds and mitigations users can apply to reduce risk: Mendix LDAP: Update toV1.1.2 or later version As a general security measure, Siemens recommends protecting network access to devices with appropriate mechanisms. To operate the devices in a protected IT environment, Siemens recommends configuring the environment according toSiemens' operational guidelines for industrial securityand following recommendations in the product manuals. Additional information on industrial security by Siemens can be found on theSiemens industrial security webpage For more information see the associated Siemens security advisory SSA-314390 inHTMLandCSAF. CISA recommends users take defensive measures to minimize the risk of exploitation of this vulnerability, such as: Minimize network exposure for all control system devices and/or systems, ensuring they arenot accessible from the internet.Locate control system networks and remote devices behind firewalls and isolating them from business networks.When remote access is required, use more secure methods, such as Virtual Private Networks (VPNs). Recognize VPNs may have vulnerabilities, should be updated to the most recent version available, and are only as secure as the connected devices. CISA reminds organizations to perform proper impact analysis and risk assessment prior to deploying defensive measures. CISA also provides a section forcontrol systems security recommended practiceson the ICS webpage oncisa.gov. Several CISA products detailing cyber defense best practices are available for reading and download, includingImproving Industrial Control Systems Cybersecurity with Defense-in-Depth Strategies. CISA encourages organizations to implement recommended cybersecurity strategies forproactive defense of ICS assets. Additional mitigation guidance and recommended practices are publicly available on the ICS webpage atcisa.govin the technical information paper,ICS-TIP-12-146-01B--Targeted Cyber Intrusion Detection and Mitigation Strategies. Organizations observing suspected malicious activity should follow established internal procedures and report findings to CISA for tracking and correlation against other incidents. CISA also recommends users take the following measures to protect themselves from social engineering attacks: Do not click web links or open attachments in unsolicited email messages.Refer toRecognizing and Avoiding Email Scamsfor more information on avoiding email scams.Refer toAvoiding Social Engineering and Phishing Attacksfor more information on social engineering attacks. No known public exploitation specifically targeting this vulnerability has been reported to CISA at this time. This vulnerability has a high attack complexity."
https://www.cisa.gov/news-events/ics-advisories/icsa-25-016-02,"4. MITIGATIONS Siemens has identified the following specific workarounds and mitigations users can apply to reduce risk: Industrial Edge Management OS (IEM-OS): Currently no fix is planned. Migrate to Industrial Edge Management Virtual (IEM-V) As a general security measure, Siemens recommends protecting network access to devices with appropriate mechanisms. To operate the devices in a protected IT environment, Siemens recommends configuring the environment according toSiemens' operational guidelines for industrial securityand following recommendations in the product manuals. Additional information on industrial security by Siemens can be found on theSiemens industrial security webpage. For more information see the associated Siemens security advisory SSA-416411 inHTMLandCSAF. CISA recommends users take defensive measures to minimize the risk of exploitation of this vulnerability, such as: Minimize network exposure for all control system devices and/or systems, ensuring they arenot accessible from the internet.Locate control system networks and remote devices behind firewalls and isolating them from business networks.When remote access is required, use more secure methods, such as Virtual Private Networks (VPNs). Recognize VPNs may have vulnerabilities, should be updated to the most recent version available, and are only as secure as the connected devices. CISA reminds organizations to perform proper impact analysis and risk assessment prior to deploying defensive measures. CISA also provides a section forcontrol systems security recommended practiceson the ICS webpage oncisa.gov. Several CISA products detailing cyber defense best practices are available for reading and download, includingImproving Industrial Control Systems Cybersecurity with Defense-in-Depth Strategies. CISA encourages organizations to implement recommended cybersecurity strategies forproactive defense of ICS assets. Additional mitigation guidance and recommended practices are publicly available on the ICS webpage atcisa.govin the technical information paper,ICS-TIP-12-146-01B--Targeted Cyber Intrusion Detection and Mitigation Strategies. Organizations observing suspected malicious activity should follow established internal procedures and report findings to CISA for tracking and correlation against other incidents. CISA also recommends users take the following measures to protect themselves from social engineering attacks: Do not click web links or open attachments in unsolicited email messages.Refer toRecognizing and Avoiding Email Scamsfor more information on avoiding email scams.Refer toAvoiding Social Engineering and Phishing Attacksfor more information on social engineering attacks. No known public exploitation specifically targeting this vulnerability has been reported to CISA at this time. This vulnerability has a high attack complexity."
https://www.cisa.gov/news-events/ics-advisories/icsa-25-016-03,"4. MITIGATIONS Siemens has identified the following specific workarounds and mitigations users can apply to reduce risk: Ensure that only trusted people get local access to the driver log files on the Recording Server.Update toV13.5 or later version. As a general security measure, Siemens recommends protecting network access to devices with appropriate mechanisms. To operate the devices in a protected IT environment, Siemens recommends configuring the environment according toSiemens' operational guidelines for industrial securityand following recommendations in the product manuals. Additional information on industrial security by Siemens can be found on theSiemens industrial security webpage For more information see the associated Siemens security advisory SSA-404759 inHTMLandCSAF. CISA recommends users take defensive measures to minimize the risk of exploitation of this vulnerability, such as: Minimize network exposure for all control system devices and/or systems, ensuring they arenot accessible from the internet.Locate control system networks and remote devices behind firewalls and isolating them from business networks.When remote access is required, use more secure methods, such as Virtual Private Networks (VPNs). Recognize VPNs may have vulnerabilities, should be updated to the most recent version available, and are only as secure as the connected devices. CISA reminds organizations to perform proper impact analysis and risk assessment prior to deploying defensive measures. CISA also provides a section forcontrol systems security recommended practiceson the ICS webpage oncisa.gov. Several CISA products detailing cyber defense best practices are available for reading and download, includingImproving Industrial Control Systems Cybersecurity with Defense-in-Depth Strategies. CISA encourages organizations to implement recommended cybersecurity strategies forproactive defense of ICS assets. Additional mitigation guidance and recommended practices are publicly available on the ICS webpage atcisa.govin the technical information paper,ICS-TIP-12-146-01B--Targeted Cyber Intrusion Detection and Mitigation Strategies. Organizations observing suspected malicious activity should follow established internal procedures and report findings to CISA for tracking and correlation against other incidents. No known public exploitation specifically targeting this vulnerability has been reported to CISA at this time. This vulnerability is not exploitable remotely. This vulnerability has a high attack complexity."
