URL,Content
https://www.cisa.gov/news-events/ics-advisories/icsa-25-044-02,"4. MITIGATIONS Siemens has identified the following specific workarounds and mitigations users can apply to reduce risk: SIMATIC Drive Controller CPU 1504D TF (6ES7615-4DF10-0AB0), SIMATIC Drive Controller CPU 1507D TF (6ES7615-7DF10-0AB0), SIMATIC ET 200SP Open Controller CPU 1515SP PC2 (incl. SIPLUS variants), SIMATIC S7-1500 CPU 1510SP F-1 PN (6ES7510-1SK03-0AB0), SIMATIC S7-1500 CPU 1510SP-1 PN (6ES7510-1DK03-0AB0), SIMATIC S7-1500 CPU 1511-1 PN (6ES7511-1AL03-0AB0), SIMATIC S7-1500 CPU 1511C-1 PN (6ES7511-1CL03-0AB0), SIMATIC S7-1500 CPU 1511F-1 PN (6ES7511-1FL03-0AB0), SIMATIC S7-1500 CPU 1511T-1 PN (6ES7511-1TL03-0AB0), SIMATIC S7-1500 CPU 1511TF-1 PN (6ES7511-1UL03-0AB0), SIMATIC S7-1500 CPU 1512C-1 PN (6ES7512-1CM03-0AB0), SIMATIC S7-1500 CPU 1512SP F-1 PN (6ES7512-1SM03-0AB0), SIMATIC S7-1500 CPU 1512SP-1 PN (6ES7512-1DM03-0AB0), SIMATIC S7-1500 CPU 1513-1 PN (6ES7513-1AM03-0AB0), SIMATIC S7-1500 CPU 1513F-1 PN (6ES7513-1FM03-0AB0), SIMATIC S7-1500 CPU 1513pro F-2 PN (6ES7513-2GM03-0AB0), SIMATIC S7-1500 CPU 1513pro-2 PN (6ES7513-2PM03-0AB0), SIMATIC S7-1500 CPU 1513R-1 PN (6ES7513-1RM03-0AB0), SIMATIC S7-1500 CPU 1514SP F-2 PN (6ES7514-2SN03-0AB0), SIMATIC S7-1500 CPU 1514SP-2 PN (6ES7514-2DN03-0AB0), SIMATIC S7-1500 CPU 1514SPT F-2 PN (6ES7514-2WN03-0AB0), SIMATIC S7-1500 CPU 1514SPT-2 PN (6ES7514-2VN03-0AB0), SIMATIC S7-1500 CPU 1515-2 PN (6ES7515-2AN03-0AB0), SIMATIC S7-1500 CPU 1515F-2 PN (6ES7515-2FN03-0AB0), SIMATIC S7-1500 CPU 1515R-2 PN (6ES7515-2RN03-0AB0), SIMATIC S7-1500 CPU 1515T-2 PN (6ES7515-2TN03-0AB0), SIMATIC S7-1500 CPU 1515TF-2 PN (6ES7515-2UN03-0AB0), SIMATIC S7-1500 CPU 1516-3 PN/DP (6ES7516-3AP03-0AB0), SIMATIC S7-1500 CPU 1516F-3 PN/DP (6ES7516-3FP03-0AB0), SIMATIC S7-1500 CPU 1516pro F-2 PN (6ES7516-2GP03-0AB0), SIMATIC S7-1500 CPU 1516pro-2 PN (6ES7516-2PP03-0AB0), SIMATIC S7-1500 CPU 1516T-3 PN/DP (6ES7516-3TN00-0AB0), SIMATIC S7-1500 CPU 1516TF-3 PN/DP (6ES7516-3UN00-0AB0), SIMATIC S7-1500 CPU 1517-3 PN/DP (6ES7517-3AP00-0AB0), SIMATIC S7-1500 CPU 1517F-3 PN/DP (6ES7517-3FP00-0AB0), SIMATIC S7-1500 CPU 1517F-3 PN/DP (6ES7517-3FP01-0AB0), SIMATIC S7-1500 CPU 1517H-3 PN (6ES7517-3HP00-0AB0), SIMATIC S7-1500 CPU 1517T-3 PN/DP (6ES7517-3TP00-0AB0), SIMATIC S7-1500 CPU 1517TF-3 PN/DP (6ES7517-3UP00-0AB0), SIMATIC S7-1500 CPU 1518-4 PN/DP (6ES7518-4AP00-0AB0), SIMATIC S7-1500 CPU 1518-4 PN/DP MFP (6ES7518-4AX00-1AB0), SIMATIC S7-1500 CPU 1518-4 PN/DP MFP (6ES7518-4AX00-1AC0), SIMATIC S7-1500 CPU 1518F-4 PN/DP (6ES7518-4FP00-0AB0), SIMATIC S7-1500 CPU 1518F-4 PN/DP MFP (6ES7518-4FX00-1AB0), SIMATIC S7-1500 CPU 1518F-4 PN/DP MFP (6ES7518-4FX00-1AC0), SIMATIC S7-1500 CPU 1518HF-4 PN (6ES7518-4JP00-0AB0), SIMATIC S7-1500 CPU 1518T-4 PN/DP (6ES7518-4TP00-0AB0), SIMATIC S7-1500 CPU 1518TF-4 PN/DP (6ES7518-4UP00-0AB0), SIMATIC S7-1500 Software Controller, SIMATIC S7-PLCSIM Advanced, SIPLUS S7-1500 CPU 1517H-3 PN (6AG1517-3HP00-4AB0), SIPLUS S7-1500 CPU 1518-4 PN/DP (6AG1518-4AP00-4AB0), SIPLUS S7-1500 CPU 1518-4 PN/DP MFP (6AG1518-4AX00-4AC0), SIPLUS S7-1500 CPU 1518F-4 PN/DP (6AG1518-4FP00-4AB0), SIPLUS S7-1500 CPU 1518HF-4 PN (6AG1518-4JP00-4AB0): Disable HTTP (Port 80/tcp) and provide web service access through HTTPS (Port 443/tcp) only; the vulnerability is considered as only exploitable via HTTP.SIMATIC ET 200SP Open Controller CPU 1515SP PC2 (incl. SIPLUS variants), SIMATIC S7-1500 Software Controller: Currently no fix is available.SIMATIC S7-1500 CPU 1510SP F-1 PN (6ES7510-1SK03-0AB0), SIMATIC S7-1500 CPU 1510SP-1 PN (6ES7510-1DK03-0AB0), SIMATIC S7-1500 CPU 1511-1 PN (6ES7511-1AL03-0AB0), SIMATIC S7-1500 CPU 1511C-1 PN (6ES7511-1CL03-0AB0), SIMATIC S7-1500 CPU 1511F-1 PN (6ES7511-1FL03-0AB0), SIMATIC S7-1500 CPU 1511T-1 PN (6ES7511-1TL03-0AB0), SIMATIC S7-1500 CPU 1511TF-1 PN (6ES7511-1UL03-0AB0), SIMATIC S7-1500 CPU 1512C-1 PN (6ES7512-1CM03-0AB0), SIMATIC S7-1500 CPU 1512SP F-1 PN (6ES7512-1SM03-0AB0), SIMATIC S7-1500 CPU 1512SP-1 PN (6ES7512-1DM03-0AB0), SIMATIC S7-1500 CPU 1513-1 PN (6ES7513-1AM03-0AB0), SIMATIC S7-1500 CPU 1513F-1 PN (6ES7513-1FM03-0AB0), SIMATIC S7-1500 CPU 1513pro F-2 PN (6ES7513-2GM03-0AB0), SIMATIC S7-1500 CPU 1513pro-2 PN (6ES7513-2PM03-0AB0), SIMATIC S7-1500 CPU 1513R-1 PN (6ES7513-1RM03-0AB0), SIMATIC S7-1500 CPU 1514SP F-2 PN (6ES7514-2SN03-0AB0), SIMATIC S7-1500 CPU 1514SP-2 PN (6ES7514-2DN03-0AB0), SIMATIC S7-1500 CPU 1514SPT F-2 PN (6ES7514-2WN03-0AB0), SIMATIC S7-1500 CPU 1514SPT-2 PN (6ES7514-2VN03-0AB0), SIMATIC S7-1500 CPU 1515-2 PN (6ES7515-2AN03-0AB0), SIMATIC S7-1500 CPU 1515F-2 PN (6ES7515-2FN03-0AB0), SIMATIC S7-1500 CPU 1515R-2 PN (6ES7515-2RN03-0AB0), SIMATIC S7-1500 CPU 1515T-2 PN (6ES7515-2TN03-0AB0), SIMATIC S7-1500 CPU 1515TF-2 PN (6ES7515-2UN03-0AB0), SIMATIC S7-1500 CPU 1516-3 PN/DP (6ES7516-3AP03-0AB0), SIMATIC S7-1500 CPU 1516F-3 PN/DP (6ES7516-3FP03-0AB0), SIMATIC S7-1500 CPU 1516pro F-2 PN (6ES7516-2GP03-0AB0), SIMATIC S7-1500 CPU 1516pro-2 PN (6ES7516-2PP03-0AB0), SIMATIC S7-1500 CPU 1516T-3 PN/DP (6ES7516-3TN00-0AB0), SIMATIC S7-1500 CPU 1516TF-3 PN/DP (6ES7516-3UN00-0AB0), SIMATIC S7-1500 CPU 1517-3 PN/DP (6ES7517-3AP00-0AB0), SIMATIC S7-1500 CPU 1517F-3 PN/DP (6ES7517-3FP00-0AB0), SIMATIC S7-1500 CPU 1517F-3 PN/DP (6ES7517-3FP01-0AB0), SIMATIC S7-1500 CPU 1517H-3 PN (6ES7517-3HP00-0AB0), SIMATIC S7-1500 CPU 1517T-3 PN/DP (6ES7517-3TP00-0AB0), SIMATIC S7-1500 CPU 1517TF-3 PN/DP (6ES7517-3UP00-0AB0), SIMATIC S7-1500 CPU 1518-4 PN/DP (6ES7518-4AP00-0AB0), SIMATIC S7-1500 CPU 1518-4 PN/DP MFP (6ES7518-4AX00-1AB0), SIMATIC S7-1500 CPU 1518-4 PN/DP MFP (6ES7518-4AX00-1AC0), SIMATIC S7-1500 CPU 1518F-4 PN/DP (6ES7518-4FP00-0AB0), SIMATIC S7-1500 CPU 1518F-4 PN/DP MFP (6ES7518-4FX00-1AB0), SIMATIC S7-1500 CPU 1518F-4 PN/DP MFP (6ES7518-4FX00-1AC0), SIMATIC S7-1500 CPU 1518HF-4 PN (6ES7518-4JP00-0AB0), SIMATIC S7-1500 CPU 1518T-4 PN/DP (6ES7518-4TP00-0AB0), SIMATIC S7-1500 CPU 1518TF-4 PN/DP (6ES7518-4UP00-0AB0), SIPLUS S7-1500 CPU 1517H-3 PN (6AG1517-3HP00-4AB0), SIPLUS S7-1500 CPU 1518-4 PN/DP (6AG1518-4AP00-4AB0), SIPLUS S7-1500 CPU 1518-4 PN/DP MFP (6AG1518-4AX00-4AC0), SIPLUS S7-1500 CPU 1518F-4 PN/DP (6AG1518-4FP00-4AB0), SIPLUS S7-1500 CPU 1518HF-4 PN (6AG1518-4JP00-4AB0): Update to V3.1.2 or alater version.SIMATIC Drive Controller CPU 1504D TF (6ES7615-4DF10-0AB0), SIMATIC Drive Controller CPU 1507D TF (6ES7615-7DF10-0AB0): Update to V3.1.2 or later version.SIPLUS S7-1200 CPU 1212 AC/DC/RLY (6AG1212-1BE40-2XB0), SIPLUS S7-1200 CPU 1212 AC/DC/RLY (6AG1212-1BE40-4XB0), SIPLUS S7-1200 CPU 1212 DC/DC/RLY (6AG1212-1HE40-2XB0), SIPLUS S7-1200 CPU 1212 DC/DC/RLY (6AG1212-1HE40-4XB0), SIPLUS S7-1200 CPU 1212C DC/DC/DC (6AG1212-1AE40-2XB0), SIPLUS S7-1200 CPU 1212C DC/DC/DC (6AG1212-1AE40-4XB0), SIPLUS S7-1200 CPU 1212C DC/DC/DC RAIL (6AG2212-1AE40-1XB0), SIPLUS S7-1200 CPU 1214 AC/DC/RLY (6AG1214-1BG40-2XB0), SIPLUS S7-1200 CPU 1214 AC/DC/RLY (6AG1214-1BG40-4XB0), SIPLUS S7-1200 CPU 1214 AC/DC/RLY (6AG1214-1BG40-5XB0), SIPLUS S7-1200 CPU 1214 DC/DC/DC (6AG1214-1AG40-2XB0), SIPLUS S7-1200 CPU 1214 DC/DC/DC (6AG1214-1AG40-4XB0), SIPLUS S7-1200 CPU 1214 DC/DC/DC (6AG1214-1AG40-5XB0), SIPLUS S7-1200 CPU 1214 DC/DC/RLY (6AG1214-1HG40-2XB0), SIPLUS S7-1200 CPU 1214 DC/DC/RLY (6AG1214-1HG40-4XB0), SIPLUS S7-1200 CPU 1214 DC/DC/RLY (6AG1214-1HG40-5XB0), SIPLUS S7-1200 CPU 1214C DC/DC/DC RAIL (6AG2214-1AG40-1XB0), SIPLUS S7-1200 CPU 1214FC DC/DC/DC (6AG1214-1AF40-5XB0), SIPLUS S7-1200 CPU 1214FC DC/DC/RLY (6AG1214-1HF40-5XB0), SIPLUS S7-1200 CPU 1215 AC/DC/RLY (6AG1215-1BG40-2XB0), SIPLUS S7-1200 CPU 1215 AC/DC/RLY (6AG1215-1BG40-4XB0), SIPLUS S7-1200 CPU 1215 AC/DC/RLY (6AG1215-1BG40-5XB0), SIPLUS S7-1200 CPU 1215 DC/DC/DC (6AG1215-1AG40-2XB0), SIPLUS S7-1200 CPU 1215 DC/DC/DC (6AG1215-1AG40-4XB0), SIPLUS S7-1200 CPU 1215 DC/DC/RLY (6AG1215-1HG40-2XB0), SIPLUS S7-1200 CPU 1215 DC/DC/RLY (6AG1215-1HG40-4XB0), SIPLUS S7-1200 CPU 1215 DC/DC/RLY (6AG1215-1HG40-5XB0), SIPLUS S7-1200 CPU 1215C DC/DC/DC (6AG1215-1AG40-5XB0), SIPLUS S7-1200 CPU 1215FC DC/DC/DC (6AG1215-1AF40-5XB0): Update to V4.7 or alater version.SIMATIC S7-1200 CPU 1211C AC/DC/Rly (6ES7211-1BE40-0XB0), SIMATIC S7-1200 CPU 1211C DC/DC/DC (6ES7211-1AE40-0XB0), SIMATIC S7-1200 CPU 1211C DC/DC/Rly (6ES7211-1HE40-0XB0), SIMATIC S7-1200 CPU 1212C AC/DC/Rly (6ES7212-1BE40-0XB0), SIMATIC S7-1200 CPU 1212C DC/DC/DC (6ES7212-1AE40-0XB0), SIMATIC S7-1200 CPU 1212C DC/DC/Rly (6ES7212-1HE40-0XB0), SIMATIC S7-1200 CPU 1212FC DC/DC/DC (6ES7212-1AF40-0XB0), SIMATIC S7-1200 CPU 1212FC DC/DC/Rly (6ES7212-1HF40-0XB0), SIMATIC S7-1200 CPU 1214C AC/DC/Rly (6ES7214-1BG40-0XB0), SIMATIC S7-1200 CPU 1214C DC/DC/DC (6ES7214-1AG40-0XB0), SIMATIC S7-1200 CPU 1214C DC/DC/Rly (6ES7214-1HG40-0XB0), SIMATIC S7-1200 CPU 1214FC DC/DC/DC (6ES7214-1AF40-0XB0), SIMATIC S7-1200 CPU 1214FC DC/DC/Rly (6ES7214-1HF40-0XB0), SIMATIC S7-1200 CPU 1215C AC/DC/Rly (6ES7215-1BG40-0XB0), SIMATIC S7-1200 CPU 1215C DC/DC/DC (6ES7215-1AG40-0XB0), SIMATIC S7-1200 CPU 1215C DC/DC/Rly (6ES7215-1HG40-0XB0), SIMATIC S7-1200 CPU 1215FC DC/DC/DC (6ES7215-1AF40-0XB0), SIMATIC S7-1200 CPU 1215FC DC/DC/Rly (6ES7215-1HF40-0XB0), SIMATIC S7-1200 CPU 1217C DC/DC/DC (6ES7217-1AG40-0XB0): Update to V4.7 or alater version.SIMATIC S7-PLCSIM Advanced: Update to V7.0 or alater version. As a general security measure, Siemens recommends protecting network access to devices with appropriate mechanisms. To operate the devices in a protected IT environment, Siemens recommends configuring the environment according toSiemens' operational guidelines for industrial securityand following recommendations in the product manuals. Additional information on industrial security by Siemens can be found on theSiemens industrial security webpage. For more information see the associated Siemens security advisory SSA-195895 inHTMLandCSAF. CISA recommends users take defensive measures to minimize the risk of exploitation of this vulnerability, such as: Minimize network exposure for all control system devices and/or systems, ensuring they arenot accessible from the Internet.Locate control system networks and remote devices behind firewalls and isolating them from business networks.When remote access is required, use more secure methods, such as Virtual Private Networks (VPNs). Recognize VPNs may have vulnerabilities, should be updated to the most recent version available, and are only as secure as the connected devices. CISA reminds organizations to perform proper impact analysis and risk assessment prior to deploying defensive measures. CISA also provides a section forcontrol systems security recommended practiceson the ICS webpage oncisa.gov. Several CISA products detailing cyber defense best practices are available for reading and download, includingImproving Industrial Control Systems Cybersecurity with Defense-in-Depth Strategies. CISA encourages organizations to implement recommended cybersecurity strategies forproactive defense of ICS assets. Additional mitigation guidance and recommended practices are publicly available on the ICS webpage atcisa.govin the technical information paper,ICS-TIP-12-146-01B--Targeted Cyber Intrusion Detection and Mitigation Strategies. Organizations observing suspected malicious activity should follow established internal procedures and report findings to CISA for tracking and correlation against other incidents. No known public exploitation specifically targeting this vulnerability has been reported to CISA at this time."
https://www.cisa.gov/news-events/ics-advisories/icsa-25-044-03,"4. MITIGATIONS Siemens has identified the following specific workarounds and mitigations users can apply to reduce risk: All affected products: Limit physical access to affected devices to trusted personnel.All affected products: Provision certificates signed by customer PKI as described inhttps://support.industry.siemens.com/cs/document/109768375.SIPROTEC 5 6MD85 (CP200), SIPROTEC 5 6MD86 (CP200), SIPROTEC 5 7KE85 (CP200), SIPROTEC 5 7SA86 (CP200), SIPROTEC 5 7SA87 (CP200), SIPROTEC 5 7SD86 (CP200), SIPROTEC 5 7SD87 (CP200), SIPROTEC 5 7SJ85 (CP200), SIPROTEC 5 7SJ86 (CP200), SIPROTEC 5 7SK85 (CP200), SIPROTEC 5 7SL86 (CP200), SIPROTEC 5 7SL87 (CP200), SIPROTEC 5 7SS85 (CP200), SIPROTEC 5 7ST85 (CP200), SIPROTEC 5 7UT85 (CP200), SIPROTEC 5 7UT86 (CP200), SIPROTEC 5 7UT87 (CP200), SIPROTEC 5 7VK87 (CP200): Currently no fix is planned.SIPROTEC 5 6MD84 (CP300), SIPROTEC 5 6MD85 (CP300), SIPROTEC 5 6MD86 (CP300), SIPROTEC 5 6MD89 (CP300), SIPROTEC 5 6MU85 (CP300), SIPROTEC 5 7KE85 (CP300), SIPROTEC 5 7SA82 (CP100), SIPROTEC 5 7SA82 (CP150), SIPROTEC 5 7SA86 (CP300), SIPROTEC 5 7SA87 (CP300), SIPROTEC 5 7SD82 (CP100), SIPROTEC 5 7SD82 (CP150), SIPROTEC 5 7SD86 (CP300), SIPROTEC 5 7SD87 (CP300), SIPROTEC 5 7SJ81 (CP100), SIPROTEC 5 7SJ81 (CP150), SIPROTEC 5 7SJ82 (CP100), SIPROTEC 5 7SJ82 (CP150), SIPROTEC 5 7SJ85 (CP300), SIPROTEC 5 7SJ86 (CP300), SIPROTEC 5 7SK82 (CP100), SIPROTEC 5 7SK82 (CP150), SIPROTEC 5 7SK85 (CP300), SIPROTEC 5 7SL82 (CP100), SIPROTEC 5 7SL82 (CP150), SIPROTEC 5 7SL86 (CP300), SIPROTEC 5 7SL87 (CP300), SIPROTEC 5 7SS85 (CP300), SIPROTEC 5 7ST85 (CP300), SIPROTEC 5 7ST86 (CP300), SIPROTEC 5 7SX82 (CP150), SIPROTEC 5 7SX85 (CP300), SIPROTEC 5 7SY82 (CP150), SIPROTEC 5 7UM85 (CP300), SIPROTEC 5 7UT82 (CP100), SIPROTEC 5 7UT82 (CP150), SIPROTEC 5 7UT85 (CP300), SIPROTEC 5 7UT86 (CP300), SIPROTEC 5 7UT87 (CP300), SIPROTEC 5 7VE85 (CP300), SIPROTEC 5 7VK87 (CP300), SIPROTEC 5 7VU85 (CP300), SIPROTEC 5 Compact 7SX800 (CP050): Currently no fix is available. As a general security measure, Siemens recommends protecting network access to devices with appropriate mechanisms. To operate the devices in a protected IT environment, Siemens recommends configuring the environment according toSiemens' operational guidelines for industrial securityand following recommendations in the product manuals. Additional information on industrial security by Siemens can be found on theSiemens industrial security webpage. For more information see the associated Siemens security advisory SSA-111547 inHTMLandCSAF. CISA recommends users take defensive measures to minimize the risk of exploitation of this vulnerability, such as: Minimize network exposure for all control system devices and/or systems, ensuring they arenot accessible from the Internet.Locate control system networks and remote devices behind firewalls and isolating them from business networks.When remote access is required, use more secure methods, such as Virtual Private Networks (VPNs). Recognize VPNs may have vulnerabilities, should be updated to the most recent version available, and are only as secure as the connected devices. CISA reminds organizations to perform proper impact analysis and risk assessment prior to deploying defensive measures. CISA also provides a section forcontrol systems security recommended practiceson the ICS webpage oncisa.gov. Several CISA products detailing cyber defense best practices are available for reading and download, includingImproving Industrial Control Systems Cybersecurity with Defense-in-Depth Strategies. CISA encourages organizations to implement recommended cybersecurity strategies forproactive defense of ICS assets. Additional mitigation guidance and recommended practices are publicly available on the ICS webpage atcisa.govin the technical information paper,ICS-TIP-12-146-01B--Targeted Cyber Intrusion Detection and Mitigation Strategies. Organizations observing suspected malicious activity should follow established internal procedures and report findings to CISA for tracking and correlation against other incidents. No known public exploitation specifically targeting this vulnerability has been reported to CISA at this time. This vulnerability is not exploitable remotely."
https://www.cisa.gov/news-events/ics-advisories/icsa-25-044-04,"4. MITIGATIONS Siemens has identified the following specific workarounds and mitigations users can apply to reduce risk: All affected products: Restrict physical access to authorized individuals only to limit exposureSIPROTEC 5 6MD85 (CP200), SIPROTEC 5 6MD86 (CP200), SIPROTEC 5 7KE85 (CP200), SIPROTEC 5 7SA86 (CP200), SIPROTEC 5 7SA87 (CP200), SIPROTEC 5 7SD86 (CP200), SIPROTEC 5 7SD87 (CP200), SIPROTEC 5 7SJ85 (CP200), SIPROTEC 5 7SJ86 (CP200), SIPROTEC 5 7SK85 (CP200), SIPROTEC 5 7SL86 (CP200), SIPROTEC 5 7SL87 (CP200), SIPROTEC 5 7SS85 (CP200), SIPROTEC 5 7ST85 (CP200), SIPROTEC 5 7UT85 (CP200), SIPROTEC 5 7UT86 (CP200), SIPROTEC 5 7UT87 (CP200), SIPROTEC 5 7VK87 (CP200): Currently no fix is plannedSIPROTEC 5 7KE85 (CP300), SIPROTEC 5 7SA82 (CP100), SIPROTEC 5 7SD82 (CP100), SIPROTEC 5 7SJ81 (CP100), SIPROTEC 5 7SJ82 (CP100), SIPROTEC 5 7SK82 (CP100), SIPROTEC 5 7SL82 (CP100), SIPROTEC 5 7ST85 (CP300), SIPROTEC 5 7ST86 (CP300), SIPROTEC 5 7UT82 (CP100): Currently no fix is availableSIPROTEC 5 Compact 7SX800 (CP050):Update to V9.90 or later version.SIPROTEC 5 7SA82 (CP150), SIPROTEC 5 7SD82 (CP150), SIPROTEC 5 7SJ81 (CP150), SIPROTEC 5 7SJ82 (CP150), SIPROTEC 5 7SK82 (CP150), SIPROTEC 5 7SL82 (CP150), SIPROTEC 5 7SX82 (CP150), SIPROTEC 5 7SY82 (CP150), SIPROTEC 5 7UT82 (CP150):Update to V9.90 or later version.SIPROTEC 5 6MD84 (CP300), SIPROTEC 5 6MD85 (CP300), SIPROTEC 5 6MD86 (CP300), SIPROTEC 5 6MD89 (CP300), SIPROTEC 5 6MU85 (CP300), SIPROTEC 5 7SA86 (CP300), SIPROTEC 5 7SA87 (CP300), SIPROTEC 5 7SD86 (CP300), SIPROTEC 5 7SD87 (CP300), SIPROTEC 5 7SJ85 (CP300), SIPROTEC 5 7SJ86 (CP300), SIPROTEC 5 7SK85 (CP300), SIPROTEC 5 7SL86 (CP300), SIPROTEC 5 7SL87 (CP300), SIPROTEC 5 7SS85 (CP300), SIPROTEC 5 7SX85 (CP300), SIPROTEC 5 7UM85 (CP300), SIPROTEC 5 7UT85 (CP300), SIPROTEC 5 7UT86 (CP300), SIPROTEC 5 7UT87 (CP300), SIPROTEC 5 7VE85 (CP300), SIPROTEC 5 7VK87 (CP300), SIPROTEC 5 7VU85 (CP300):Update to V9.90 or later version. Operators of critical power systems (e.g. TSOs or DSOs) worldwide are usually required by regulations to build resilience into the power grids by applying multi-level redundant secondary protection schemes. It is therefore recommended that the operators check whether appropriate resilient protection measures are in place. The risk of cyber incidents impacting the grid's reliability can thus be minimized by virtue of the grid design. Siemens strongly recommends applying the provided security updates using the corresponding tooling and documented procedures made available with the product. If supported by the product, an automated means to apply the security updates across multiple product instances may be used. Siemens strongly recommends prior validation of any security update before being applied, and supervision by trained staff of the update process in the target environment. As a general security measure Siemens strongly recommends to protect network access with appropriate mechanisms (e.g. firewalls, segmentation, VPN). It is advised to configure the environment according to our operational guidelines in order to run the devices in a protected IT environment. Siemens recommends followinggrid security guidelines. For more information see the associated Siemens security advisory SSA-687955 inHTMLandCSAF. CISA recommends users take defensive measures to minimize the risk of exploitation of this vulnerability. CISA reminds organizations to perform proper impact analysis and risk assessment prior to deploying defensive measures. CISA also provides a section forcontrol systems security recommended practiceson the ICS webpage oncisa.gov. Several CISA products detailing cyber defense best practices are available for reading and download, includingImproving Industrial Control Systems Cybersecurity with Defense-in-Depth Strategies. CISA encourages organizations to implement recommended cybersecurity strategies forproactive defense of ICS assets. Additional mitigation guidance and recommended practices are publicly available on the ICS webpage atcisa.govin the technical information paper,ICS-TIP-12-146-01B--Targeted Cyber Intrusion Detection and Mitigation Strategies. Organizations observing suspected malicious activity should follow established internal procedures and report findings to CISA for tracking and correlation against other incidents. No known public exploitation specifically targeting this vulnerability has been reported to CISA at this time. This vulnerability is not exploitable remotely."
https://www.cisa.gov/news-events/ics-advisories/icsa-25-044-05,"4. MITIGATIONS Siemens has identified the following specific workarounds and mitigations users can apply to reduce risk: All affected products: Restrict access to port 161/udp to trusted IP addresses only.All affected products: Disable the SNMP service running in the communication modules, if not used.SIPROTEC 5 7KE85 (CP300), SIPROTEC 5 7ST85 (CP300), SIPROTEC 5 7ST86 (CP300): Currently no fix is available.SIPROTEC 5 Compact 7SX800 (CP050):Update to V9.90 or later version.SIPROTEC 5 7SA82 (CP150), SIPROTEC 5 7SD82 (CP150), SIPROTEC 5 7SJ81 (CP150), SIPROTEC 5 7SJ82 (CP150), SIPROTEC 5 7SK82 (CP150), SIPROTEC 5 7SL82 (CP150), SIPROTEC 5 7SX82 (CP150), SIPROTEC 5 7SY82 (CP150), SIPROTEC 5 7UT82 (CP150):Update to V9.90 or later version.SIPROTEC 5 6MD84 (CP300), SIPROTEC 5 6MD85 (CP300), SIPROTEC 5 6MD86 (CP300), SIPROTEC 5 6MD89 (CP300), SIPROTEC 5 6MU85 (CP300), SIPROTEC 5 7SA86 (CP300), SIPROTEC 5 7SA87 (CP300), SIPROTEC 5 7SD86 (CP300), SIPROTEC 5 7SD87 (CP300), SIPROTEC 5 7SJ85 (CP300), SIPROTEC 5 7SJ86 (CP300), SIPROTEC 5 7SK85 (CP300), SIPROTEC 5 7SL86 (CP300), SIPROTEC 5 7SL87 (CP300), SIPROTEC 5 7SS85 (CP300), SIPROTEC 5 7SX85 (CP300), SIPROTEC 5 7UM85 (CP300), SIPROTEC 5 7UT85 (CP300), SIPROTEC 5 7UT86 (CP300), SIPROTEC 5 7UT87 (CP300), SIPROTEC 5 7VE85 (CP300), SIPROTEC 5 7VK87 (CP300), SIPROTEC 5 7VU85 (CP300):Update to V9.90 or later version.SIPROTEC 5 Communication Module ETH-BA-2EL (Rev.2), SIPROTEC 5 Communication Module ETH-BB-2FO (Rev. 2), SIPROTEC 5 Communication Module ETH-BD-2FO:Update to V9.90 or later version. As a general security measure, Siemens recommends protecting network access to devices with appropriate mechanisms. To operate the devices in a protected IT environment, Siemens recommends configuring the environment according toSiemens' operational guidelines for industrial securityand following recommendations in the product manuals. Additional information on industrial security by Siemens can be found on theSiemens industrial security webpage For more information see the associated Siemens security advisory SSA-767615 inHTMLandCSAF. CISA recommends users take defensive measures to minimize the risk of exploitation of this vulnerability, such as: Minimize network exposure for all control system devices and/or systems, ensuring they arenot accessible from the internet.Locate control system networks and remote devices behind firewalls and isolating them from business networks.When remote access is required, use more secure methods, such as Virtual Private Networks (VPNs). Recognize VPNs may have vulnerabilities, should be updated to the most recent version available, and are only as secure as the connected devices. CISA reminds organizations to perform proper impact analysis and risk assessment prior to deploying defensive measures. CISA also provides a section forcontrol systems security recommended practiceson the ICS webpage oncisa.gov. Several CISA products detailing cyber defense best practices are available for reading and download, includingImproving Industrial Control Systems Cybersecurity with Defense-in-Depth Strategies. CISA encourages organizations to implement recommended cybersecurity strategies forproactive defense of ICS assets. Additional mitigation guidance and recommended practices are publicly available on the ICS webpage atcisa.govin the technical information paper,ICS-TIP-12-146-01B--Targeted Cyber Intrusion Detection and Mitigation Strategies. Organizations observing suspected malicious activity should follow established internal procedures and report findings to CISA for tracking and correlation against other incidents. No known public exploitation specifically targeting this vulnerability has been reported to CISA at this time."
