URL,Content
https://www.cisa.gov/news-events/ics-advisories/icsa-25-037-04,"4. MITIGATIONS Cityworks has released the following update guidance for users: Trimble will be releasing updated versions to both 15.x (15.8.9 available January 28, 2025) and Cityworks 23.x software releases (23.10 available January 29, 2025). Information on the updated versions will be available through the normal channels via theCityworks Support Portal(Login required). On-premise users should install the updated version immediately. These updates will be automatically applied to all Cityworks Online (CWOL) deployments.Trimble has observed that some on-premise deployments may have overprivileged Internet Information Services (IIS) identity permissions. For avoidance of doubt, and in accordance with Trimble's technical documentation, IIS should not be run with local or domain level administrative privileges on any site. Please refer to the direction in the latest release notes in theCityworks Support Portal(Login required) for more information on how to update IIS identity permissions. Trimble's CWOL users have their IIS identity permissions set appropriately and do not need to take this action.Trimble has observed that some deployments have inappropriate attachment directory configurations. Trimble recommends that attachment directory root configuration should be limited to folders/subfolders which only contain attachments. Please refer to the direction in the latest release notes in theCityworks Support Portal(Login required) for more information on how to ensure proper configuration of the attachment directory. For more information, see Trimble'snotification. Cityworks software is incapable of controlling industrial processes and is not directly part of an ICS. CISA reminds organizations to perform proper impact analysis and risk assessment prior to deploying defensive measures. CISA also provides a section forcontrol systems security recommended practiceson the ICS webpage oncisa.gov/ics. Several CISA products detailing cyber defense best practices are available for reading and download, includingImproving Industrial Control Systems Cybersecurity with Defense-in-Depth Strategies. CISA encourages organizations to implement recommended cybersecurity strategies forproactive defense of ICS assets. Additional mitigation guidance and recommended practices are publicly available on the ICS webpage atcisa.gov/icsin the technical information paper,ICS-TIP-12-146-01B--Targeted Cyber Intrusion Detection and Mitigation Strategies. Organizations observing suspected malicious activity should follow established internal procedures and report findings to CISA for tracking and correlation against other incidents. CISA also recommends users take the following measures to protect themselves from social engineering attacks: Do not click web links or open attachments in unsolicited email messages.Refer toRecognizing and Avoiding Email Scamsfor more information on avoiding email scams.Refer toAvoiding Social Engineering and Phishing Attacksfor more information on social engineering attacks. CISA has received reports of this vulnerability being actively exploited."
https://www.cisa.gov/news-events/ics-advisories/icsa-25-035-01,"4. MITIGATIONS Western Telematic Inc reports this issue was discovered and patched in 2020. Western Telematic Inc recommends users follow best practices and update to the latest version. For DSM/CPM units:Update to 8.06For NPS units:Update 4.02Ensure the default passwords are changed prior to deployment CISA recommends users take defensive measures to minimize the risk of exploitation of this vulnerability, such as: Minimize network exposure for all control system devices and/or systems, ensuring they arenot accessible from the Internet.Locate control system networks and remote devices behind firewalls and isolating them from business networks.When remote access is required, use more secure methods, such as Virtual Private Networks (VPNs), recognizing VPNs may have vulnerabilities and should be updated to the most current version available. Also recognize VPN is only as secure as the connected devices. CISA reminds organizations to perform proper impact analysis and risk assessment prior to deploying defensive measures. CISA also provides a section forcontrol systems security recommended practiceson the ICS webpage oncisa.gov/ics. Several CISA products detailing cyber defense best practices are available for reading and download, includingImproving Industrial Control Systems Cybersecurity with Defense-in-Depth Strategies. CISA encourages organizations to implement recommended cybersecurity strategies forproactive defense of ICS assets. Additional mitigation guidance and recommended practices are publicly available on the ICS webpage atcisa.gov/icsin the technical information paper,ICS-TIP-12-146-01B--Targeted Cyber Intrusion Detection and Mitigation Strategies. Organizations observing suspected malicious activity should follow established internal procedures and report findings to CISA for tracking and correlation against other incidents. No known public exploitation specifically targeting this vulnerability has been reported to CISA at this time."
https://www.cisa.gov/news-events/ics-advisories/icsa-25-035-02,"4. MITIGATIONS Rockwell Automation recommends users of the affected software to apply the risk mitigations, if possible. Update to V33.017, V34.014, V35.013, V36.011, or the latest version.Restrict access to the task object via CIP Security and Hard Run.For information on how to mitigate security risks on industrial automation control systems, Rockwell Automation encourages users to implement their suggestedsecurity best practicesto minimize the risk of the vulnerability. Stakeholder-Specific Vulnerability Categorizationcan be used to generate more environment-specific prioritization. For more information about this issue, please see the advisory on theRockwell Automation security page. CISA recommends users take defensive measures to minimize the risk of exploitation of this vulnerability, such as: Minimize network exposure for all control system devices and/or systems, ensuring they arenot accessible from the internet.Locate control system networks and remote devices behind firewalls and isolating them from business networks.When remote access is required, use more secure methods, such as Virtual Private Networks (VPNs), recognizing VPNs may have vulnerabilities and should be updated to the most current version available. Also recognize VPN is only as secure as the connected devices. CISA reminds organizations to perform proper impact analysis and risk assessment prior to deploying defensive measures. CISA also provides a section forcontrol systems security recommended practiceson the ICS webpage oncisa.gov/ics. Several CISA products detailing cyber defense best practices are available for reading and download, includingImproving Industrial Control Systems Cybersecurity with Defense-in-Depth Strategies. CISA encourages organizations to implement recommended cybersecurity strategies forproactive defense of ICS assets. Additional mitigation guidance and recommended practices are publicly available on the ICS webpage atcisa.gov/icsin the technical information paper,ICS-TIP-12-146-01B--Targeted Cyber Intrusion Detection and Mitigation Strategies. Organizations observing suspected malicious activity should follow established internal procedures and report findings to CISA for tracking and correlation against other incidents. CISA also recommends users take the following measures to protect themselves from social engineering attacks: Do not click web links or open attachments in unsolicited email messages.Refer toRecognizing and Avoiding Email Scamsfor more information on avoiding email scams.Refer toAvoiding Social Engineering and Phishing Attacksfor more information on social engineering attacks. No known public exploitation specifically targeting this vulnerability has been reported to CISA at this time."
https://www.cisa.gov/news-events/ics-advisories/icsa-25-035-03,"4. MITIGATIONS Elber does not plan to mitigate these vulnerabilities because this equipment is either end of life or almost end of life. Users of affected versions of Elber Signum DVB-S/S2 IRD, Cleber/3 Broadcast Multi-Purpose Platform, Reble610 M/ODU XPIC IP-ASI-SDH, ESE DVB-S/S2 Satellite Receiver, and Wayber Analog/Digital Audio STL are invited to contact Elbercustomer supportfor additional information. CISA recommends users take defensive measures to minimize the risk of exploitation of this these vulnerabilities, such as: Minimize network exposure for all control system devices and/or systems, ensuring they arenot accessible from the internet.Locate control system networks and remote devices behind firewalls and isolating them from business networks.When remote access is required, use more secure methods, such as Virtual Private Networks (VPNs), recognizing VPNs may have vulnerabilities and should be updated to the most current version available. Also recognize VPN is only as secure as the connected devices. CISA reminds organizations to perform proper impact analysis and risk assessment prior to deploying defensive measures. CISA also provides a section forcontrol systems security recommended practiceson the ICS webpage oncisa.gov/ics. Several CISA products detailing cyber defense best practices are available for reading and download, includingImproving Industrial Control Systems Cybersecurity with Defense-in-Depth Strategies. CISA encourages organizations to implement recommended cybersecurity strategies forproactive defense of ICS assets. Additional mitigation guidance and recommended practices are publicly available on the ICS webpage atcisa.gov/icsin the technical information paper,ICS-TIP-12-146-01B--Targeted Cyber Intrusion Detection and Mitigation Strategies. Organizations observing suspected malicious activity should follow established internal procedures and report findings to CISA for tracking and correlation against other incidents. CISA also recommends users take the following measures to protect themselves from social engineering attacks: Do not click web links or open attachments in unsolicited email messages.Refer toRecognizing and Avoiding Email Scamsfor more information on avoiding email scams.Refer toAvoiding Social Engineering and Phishing Attacksfor more information on social engineering attacks. No known public exploitation specifically targeting these vulnerabilities has been reported to CISA at this time."
https://www.cisa.gov/news-events/ics-advisories/icsa-25-035-04,"4. MITIGATIONS Schneider Electric has identified the following remediations users can apply to reduce risk: Modicon M580 CPU (partnumbers BMEP* and BMEH*,excluding M580 CPU Safety): Version SV4.30 of Modicon M580 firmware includes a fix for this vulnerability and isavailable for download.Modicon M580 CPU Safety part numbers BMEP58-S and MEH58-S): Version SV4.21 of Modicon M580 firmware includes a fix for this vulnerability and isavailable for download.EVLink Pro AC: Version V1.3.10 of EVLink Pro AC firmware includes a fix for this vulnerability and isavailable here. Users should use appropriate patching methodologies when applying these patches to their systems. Schneider Electric strongly recommends making use of back-ups and evaluating the impact of these patches in a testing and development environment or on an offline infrastructure. Contact Schneider Electric'sCustomer Care Centerif assistance is needed for removing a patch. If users choose not to apply the remediation provided above, they should immediately apply the following mitigations to reduce the risk of exploit: Modicon M580 CPU (partnumbers BMEP* and BMEH*,excluding M580 CPU Safety): Set up network segmentation and implement a firewall to block all unauthorized access to Port 443/TCP. Configure the access control list following the recommendations of the user manuals:""Modicon M580, Hardware, Reference Manual""Modicon M580 CPU Safety part numbers BMEP58-S and MEH58-S): Set up network segmentation and implement a firewall to block all unauthorized access to Port 443/TCP. Configure the access control list following the recommendations of the user manuals:""Modicon M580, Hardware, Reference Manual""BMENOR2200H: Schneider Electric is establishing a remediation plan for BMENOR2200H that will include a fix for CVE-2024-11425. They will update SEVD-2025-014-01 when the remediation is available. Until then, users should immediately set up network segmentation and implement a firewall to block all unauthorized access to Port 443/TCP.EVLink Pro AC: Follow theEVlink Pro AC cybersecurity guide Schneider Electric strongly recommends the following industry cybersecurity best practices. Locate control and safety system networks and remote devices behind firewalls and isolate them from the business network.Install physical controls so no unauthorized personnel can access your industrial control and safety systems, components, peripheral equipment, and networks.Place all controllers in locked cabinets and never leave them in the ""Program"" mode.Never connect programming software to any network other than the network intended for that device.Scan all methods of mobile data exchange with the isolated network such as CDs, USB drives, etc. before use in the terminals or any node connected to these networks.Never allow mobile devices that have connected to any other network besides the intended network to connect to the safety or control networks without proper sanitation.Minimize network exposure for all control system devices and systems and ensure that they are not accessible from the Internet.When remote access is required, use secure methods, such as virtual private networks (VPNs). Recognize that VPNs may have vulnerabilities and should be updated to the most current version available. Also, understand that VPNs are only as secure as the connected devices. For more information refer to theSchneider Electric Recommended Cybersecurity Best Practices document. For more information, see Schneider Electric security notification""SEVD-2025-014-01 Modicon M580 PLCs, BMENOR2200H and EVLink Pro AC"" CISA reminds organizations to perform proper impact analysis and risk assessment prior to deploying defensive measures. CISA also provides a section forcontrol systems security recommended practiceson the ICS webpage oncisa.gov/ics. Several CISA products detailing cyber defense best practices are available for reading and download, includingImproving Industrial Control Systems Cybersecurity with Defense-in-Depth Strategies. CISA encourages organizations to implement recommended cybersecurity strategies forproactive defense of ICS assets. Additional mitigation guidance and recommended practices are publicly available on the ICS webpage atcisa.gov/icsin the technical information paper,ICS-TIP-12-146-01B--Targeted Cyber Intrusion Detection and Mitigation Strategies. Organizations observing suspected malicious activity should follow established internal procedures and report findings to CISA for tracking and correlation against other incidents. No known public exploitation specifically targeting this vulnerability has been reported to CISA at this time."
https://www.cisa.gov/news-events/ics-advisories/icsa-25-035-05,"4. MITIGATIONS Web Designer tool project file is based on XML language with specific parameters. To ensure the integrity of this file please follow the recommendations below: Encrypt project file (XML configuration file) when stored and restrict the access to only trusted users.When exchanging files over the network, use secure communication protocols.Only open project files received from a trusted source.Compute a hash of the project files and regularly check the consistency of this hash to verify the integrity before usage. To ensure you are informed of all updates, including details on affected products and remediation plans, subscribe to Schneider Electric's security notification service here:https://www.se.com/ww/en/work/support/cybersecurity/security-notifications.jsp Schneider Electric strongly recommends the following industry cybersecurity best practices. Locate control and safety system networks and remote devices behind firewalls and isolate them from the business network.Install physical controls so no unauthorized personnel can access your industrial control and safety systems, components, peripheral equipment, and networks.Place all controllers in locked cabinets and never leave them in the ""Program"" mode.Never connect programming software to any network other than the network intended for that device.Scan all methods of mobile data exchange with the isolated network such as CDs, USB drives, etc. before use in the terminals or any node connected to these networks.Never allow mobile devices that have connected to any other network besides the intended network to connect to the safety or control networks without proper sanitation.Minimize network exposure for all control system devices and systems and ensure that they are not accessible from the Internet.When remote access is required, use secure methods, such as Virtual Private Networks (VPNs). Recognize that VPNs may have their own vulnerabilities and should be updated to the most current version available. Also, understand that VPNs are only as secure as the connected devices. For more information refer to theSchneider Electric Recommended Cybersecurity Best Practices document. For more information, see Schneider Electric security notification""SEVD-2025-014-04 Web Server on Modicon M340 and BMXNOE0100/0110, BMXNOR0200H communication modules"" CISA reminds organizations to perform proper impact analysis and risk assessment prior to deploying defensive measures. CISA also provides a section forcontrol systems security recommended practiceson the ICS webpage oncisa.gov/ics. Several CISA products detailing cyber defense best practices are available for reading and download, includingImproving Industrial Control Systems Cybersecurity with Defense-in-Depth Strategies. CISA encourages organizations to implement recommended cybersecurity strategies forproactive defense of ICS assets. Additional mitigation guidance and recommended practices are publicly available on the ICS webpage atcisa.gov/icsin the technical information paper,ICS-TIP-12-146-01B--Targeted Cyber Intrusion Detection and Mitigation Strategies. Organizations observing suspected malicious activity should follow established internal procedures and report findings to CISA for tracking and correlation against other incidents. CISA also recommends users take the following measures to protect themselves from social engineering attacks: Do not click web links or open attachments in unsolicited email messages.Refer toRecognizing and Avoiding Email Scamsfor more information on avoiding email scams.Refer toAvoiding Social Engineering and Phishing Attacksfor more information on social engineering attacks. No known public exploitation specifically targeting this vulnerability has been reported to CISA at this time. This vulnerability is not exploitable remotely."
https://www.cisa.gov/news-events/ics-advisories/icsa-25-035-06,"4. MITIGATIONS Schneider Electric has identified the following specific workarounds and mitigations users can apply to reduce risk: BMXNOR0200H: Version SV1.70IR26 of BMXNOR0200H includes a fix for this vulnerability and isavailable for download. Users should use appropriate patching methodologies when applying these patches to their systems. Schneider Electric strongly recommends the use of back-ups and evaluating the impact of these patches in a testing and development environment, or on an offline infrastructure. ContactSchneider Electric's Customer Care Centerfor assistance removing a patch. Schneider Electric is establishing a remediation plan for all future versions of Modicon M340 processors BMXP34*, BMXNOE0100 and BMXNOE0110 that will include a fix for this vulnerability. They will provide an update when the remediation is available. Until then, users should immediately apply the following mitigations to reduce the risk of exploit: Set up network segmentation and implement a firewall to block all unauthorized access to FTP Port 21/TCP on the devices.Disable FTP service via EcoStruxureTM Control Expert. This is disabled by default when a new application is created.Disable Web server service via EcoStruxureTM Control Expert. This is disabled by default when a new application is created.Configure the Access Control List following the recommendation on the""Modicon Controllers System Cybersecurity"" Schneider Electric strongly recommends the following industry cybersecurity best practices. Locate control and safety system networks and remote devices behind firewalls and isolate them from the business network.Install physical controls so no unauthorized personnel can access your industrial control and safety systems, components, peripheral equipment, and networks.Place all controllers in locked cabinets and never leave them in the ""Program"" mode.Never connect programming software to any network other than the network intended for that device.Scan all methods of mobile data exchange with the isolated network such as CDs, USB drives, etc. before use in the terminals or any node connected to these networks.Never allow mobile devices that have connected to any other network besides the intended network to connect to the safety or control networks without proper sanitation.Minimize network exposure for all control system devices and systems and ensure that they are not accessible from the Internet.When remote access is required, use secure methods, such as virtual private networks (VPNs). Recognize that VPNs may have vulnerabilities and should be updated to the most current version available. Also, understand that VPNs are only as secure as the connected devices. For more information refer to theSchneider Electric Recommended Cybersecurity Best Practices document. For more information, see Schneider Electric security notification""SEVD-2025-014-05 Web Server on Modicon M340 and BMXNOE0100/0110, BMXNOR0200H communication modules"" CISA reminds organizations to perform proper impact analysis and risk assessment prior to deploying defensive measures. CISA also provides a section forcontrol systems security recommended practiceson the ICS webpage oncisa.gov/ics. Several CISA products detailing cyber defense best practices are available for reading and download, includingImproving Industrial Control Systems Cybersecurity with Defense-in-Depth Strategies. CISA encourages organizations to implement recommended cybersecurity strategies forproactive defense of ICS assets. Additional mitigation guidance and recommended practices are publicly available on the ICS webpage atcisa.gov/icsin the technical information paper,ICS-TIP-12-146-01B--Targeted Cyber Intrusion Detection and Mitigation Strategies. Organizations observing suspected malicious activity should follow established internal procedures and report findings to CISA for tracking and correlation against other incidents. No known public exploitation specifically targeting this vulnerability has been reported to CISA at this time."
